iri,label,definition,comments,examples,organized_in,issued,status,replaces,rdf_type,term_iri,abcd_equivalence,flags
http://dublincore.org/usage/terms/history/#typeT-001,type,The nature or genre of the resource.,Must be populated with a value from the DCMI type vocabulary (http://dublincore.org/documents/2010/10/11/dcmi-type-vocabulary/).,"`StillImage`, `MovingImage`, `Sound`, `PhysicalObject`, `Event`, `Text`",http://purl.org/dc/terms/,2008-01-14,recommended,,http://www.w3.org/1999/02/22-rdf-syntax-ns#Property,http://purl.org/dc/terms/type,not in ABCD,simple
http://dublincore.org/usage/terms/history/#modified-003,modified,The most recent date-time on which the resource was changed.,Recommended best practice is to use a date that conforms to ISO 8601:2004(E).,`1963-03-08T14:07-0600` (8 Mar 1963 at 2:07pm in the time zone six hours earlier than UTC). `2009-02-20T08:40Z` (20 February 2009 8:40am UTC). `2018-08-29T15:19` (3:19pm local time on 29 August 2018). `1809-02-12` (some time during 12 February 1809). `1906-06` (some time in June 1906). `1971` (some time in the year 1971). `2007-03-01T13:00:00Z/2008-05-11T15:30:00Z` (some time during the interval between 1 March 2007 1pm UTC and 11 May 2008 3:30pm UTC). `1900/1909` (some time during the interval between the beginning of the year 1900 and the end of the year 1909). `2007-11-13/15` (some time in the interval between 13 November 2007 and 15 November 2007).,http://purl.org/dc/terms/,2000-07-11,recommended,http://dublincore.org/usage/terms/history/#modified-002,http://www.w3.org/1999/02/22-rdf-syntax-ns#Property,http://purl.org/dc/terms/modified,not in ABCD,simple
http://dublincore.org/usage/terms/history/#languageT-001,language,A language of the resource.,Recommended best practice is to use RFC 5646 as a controlled vocabulary.,"`en` (for English), `es` (for Spanish)",http://purl.org/dc/terms/,2008-01-14,recommended,,http://www.w3.org/1999/02/22-rdf-syntax-ns#Property,http://purl.org/dc/terms/language,not in ABCD,simple
http://dublincore.org/usage/terms/history/#license-002,license,A legal document giving official permission to do something with the resource.,,"`http://creativecommons.org/publicdomain/zero/1.0/legalcode`, `http://creativecommons.org/licenses/by/4.0/legalcode`",http://purl.org/dc/terms/,2004-06-14,recommended,http://dublincore.org/usage/terms/history/#license-001,http://www.w3.org/1999/02/22-rdf-syntax-ns#Property,http://purl.org/dc/terms/license,not in ABCD,simple
http://dublincore.org/usage/terms/history/#rightsHolder-002,rightsHolder,A person or organization owning or managing rights over the resource.,,`The Regents of the University of California`,http://purl.org/dc/terms/,2004-06-14,recommended,http://dublincore.org/usage/terms/history/#rightsHolder-001,http://www.w3.org/1999/02/22-rdf-syntax-ns#Property,http://purl.org/dc/terms/rightsHolder,not in ABCD,simple
http://dublincore.org/usage/terms/history/#accessRights-002,accessRights,"Information about who can access the resource or an indication of its security status. Access Rights may include information regarding access or restrictions based on privacy, security, or other policies.",,"`not-for-profit use only`, `https://www.fieldmuseum.org/field-museum-natural-history-conditions-and-suggested-norms-use-collections-data-and-images`",http://purl.org/dc/terms/,2003-02-15,recommended,http://dublincore.org/usage/terms/history/#accessRights-001,http://www.w3.org/1999/02/22-rdf-syntax-ns#Property,http://purl.org/dc/terms/accessRights,not in ABCD,simple
http://dublincore.org/usage/terms/history/#bibliographicCitation-002,bibliographicCitation,A bibliographic reference for the resource as a statement indicating how this record should be cited (attributed) when used.,Recommended practice is to include sufficient bibliographic detail to identify the resource as unambiguously as possible.,"Specimen example: `Museum of Vertebrate Zoology, UC Berkeley. MVZ Mammal Collection (Arctos). Record ID: http://arctos.database.museum/guid/MVZ:Mamm:165861?seid=101356. Source: http://ipt.vertnet.org:8080/ipt/resource.do?r=mvz_mammal`. Taxon example: `Oliver P. Pearson. 1985. Los tuco-tucos (genera Ctenomys) de los Parques Nacionales Lanin y Nahuel Huapi, Argentina Historia Natural, 5(37):337-343.`.",http://purl.org/dc/terms/,2003-02-15,recommended,http://dublincore.org/usage/terms/history/#bibliographicCitation-001,http://www.w3.org/1999/02/22-rdf-syntax-ns#Property,http://purl.org/dc/terms/bibliographicCitation,not in ABCD,simple
http://dublincore.org/usage/terms/history/#references-003,references,"A related resource that is referenced, cited, or otherwise pointed to by the described resource.",,"`http://arctos.database.museum/guid/MVZ:Mamm:165861`, `http://www.catalogueoflife.org/annual-checklist/show_species_details.php?record_id=6197868`",http://purl.org/dc/terms/,2000-07-11,recommended,http://dublincore.org/usage/terms/history/#references-002,http://www.w3.org/1999/02/22-rdf-syntax-ns#Property,http://purl.org/dc/terms/references,not in ABCD,simple
http://rs.tdwg.org/dwc/terms/version/institutionID-2018-09-06,institutionID,An identifier for the institution having custody of the object(s) or information referred to in the record.,"For physical specimens, the recommended best practice is to use an identifier from a collections registry such as the Global Registry of Biodiversity Repositories (http://grbio.org/).","`http://biocol.org/urn:lsid:biocol.org:col:34777`, `http://grbio.org/cool/km06-gtbn`",http://rs.tdwg.org/dwc/terms/,2017-10-06,recommended,http://rs.tdwg.org/dwc/terms/version/institutionID-2017-10-06,http://www.w3.org/1999/02/22-rdf-syntax-ns#Property,http://rs.tdwg.org/dwc/terms/institutionID,DataSets/DataSet/Units/Unit/SourceInstitutionID,simple
http://rs.tdwg.org/dwc/terms/version/collectionID-2018-09-06,collectionID,An identifier for the collection or dataset from which the record was derived.,"For physical specimens, the recommended best practice is to use an identifier from a collections registry such as the Global Registry of Biodiversity Repositories (http://grbio.org/).","`http://biocol.org/urn:lsid:biocol.org:col:1001`, `http://grbio.org/cool/p5fp-c036`",http://rs.tdwg.org/dwc/terms/,2017-10-06,recommended,http://rs.tdwg.org/dwc/terms/version/collectionID-2017-10-06,http://www.w3.org/1999/02/22-rdf-syntax-ns#Property,http://rs.tdwg.org/dwc/terms/collectionID,DataSets/DataSet/Units/Unit/SourceID,simple
http://rs.tdwg.org/dwc/terms/version/datasetID-2018-09-06,datasetID,An identifier for the set of data. May be a global unique identifier or an identifier specific to a collection or institution.,,`b15d4952-7d20-46f1-8a3e-556a512b04c5`,http://rs.tdwg.org/dwc/terms/,2017-10-06,recommended,http://rs.tdwg.org/dwc/terms/version/datasetID-2017-10-06,http://www.w3.org/1999/02/22-rdf-syntax-ns#Property,http://rs.tdwg.org/dwc/terms/datasetID,DataSets/DataSet/DataSetGUID,simple
http://rs.tdwg.org/dwc/terms/version/institutionCode-2018-09-06,institutionCode,The name (or acronym) in use by the institution having custody of the object(s) or information referred to in the record.,,"`MVZ`, `FMNH`, `CLO`, `UCMP`",http://rs.tdwg.org/dwc/terms/,2017-10-06,recommended,http://rs.tdwg.org/dwc/terms/version/institutionCode-2017-10-06,http://www.w3.org/1999/02/22-rdf-syntax-ns#Property,http://rs.tdwg.org/dwc/terms/institutionCode,DataSets/DataSet/Units/Unit/SourceInstitutionID,simple
http://rs.tdwg.org/dwc/terms/version/collectionCode-2018-09-06,collectionCode,"The name, acronym, coden, or initialism identifying the collection or data set from which the record was derived.",,"`Mammals`, `Hildebrandt`, `EBIRD`, `VP`",http://rs.tdwg.org/dwc/terms/,2017-10-06,recommended,http://rs.tdwg.org/dwc/terms/version/collectionCode-2017-10-06,http://www.w3.org/1999/02/22-rdf-syntax-ns#Property,http://rs.tdwg.org/dwc/terms/collectionCode,DataSets/DataSet/Units/Unit/SourceID,simple
http://rs.tdwg.org/dwc/terms/version/datasetName-2018-09-06,datasetName,The name identifying the data set from which the record was derived.,,"`Grinnell Resurvey Mammals`, `Lacey Ctenomys Recaptures`",http://rs.tdwg.org/dwc/terms/,2017-10-06,recommended,http://rs.tdwg.org/dwc/terms/version/datasetName-2017-10-06,http://www.w3.org/1999/02/22-rdf-syntax-ns#Property,http://rs.tdwg.org/dwc/terms/datasetName,DataSets/DataSet/Units/Unit/SourceID,simple
http://rs.tdwg.org/dwc/terms/version/ownerInstitutionCode-2018-09-06,ownerInstitutionCode,The name (or acronym) in use by the institution having ownership of the object(s) or information referred to in the record.,,"`NPS`, `APN`, `InBio`",http://rs.tdwg.org/dwc/terms/,2017-10-06,recommended,http://rs.tdwg.org/dwc/terms/version/ownerInstitutionCode-2017-10-06,http://www.w3.org/1999/02/22-rdf-syntax-ns#Property,http://rs.tdwg.org/dwc/terms/ownerInstitutionCode,not in ABCD,simple
http://rs.tdwg.org/dwc/terms/version/basisOfRecord-2018-09-06,basisOfRecord,The specific nature of the data record.,Recommended best practice is to use the standard label of one of the Darwin Core classes.,"`PreservedSpecimen`, `FossilSpecimen`, `LivingSpecimen`, `MaterialSample`, `Event`, `HumanObservation`, `MachineObservation`, `Taxon`, `Occurrence`",http://rs.tdwg.org/dwc/terms/,2017-10-06,recommended,http://rs.tdwg.org/dwc/terms/version/basisOfRecord-2017-10-06,http://www.w3.org/1999/02/22-rdf-syntax-ns#Property,http://rs.tdwg.org/dwc/terms/basisOfRecord,DataSets/DataSet/Units/Unit/RecordBasis,simple
http://rs.tdwg.org/dwc/terms/version/informationWithheld-2018-09-06,informationWithheld,"Additional information that exists, but that has not been shared in the given record.",,"`location information not given for endangered species`, `collector identities withheld | ask about tissue samples`",http://rs.tdwg.org/dwc/terms/,2017-10-06,recommended,http://rs.tdwg.org/dwc/terms/version/informationWithheld-2017-10-06,http://www.w3.org/1999/02/22-rdf-syntax-ns#Property,http://rs.tdwg.org/dwc/terms/informationWithheld,DataSets/DataSet/Units/Unit/InformationWithheld,simple
http://rs.tdwg.org/dwc/terms/version/dataGeneralizations-2018-09-06,dataGeneralizations,Actions taken to make the shared data less specific or complete than in its original form. Suggests that alternative data of higher quality may be available on request.,,`Coordinates generalized from original GPS coordinates to the nearest half degree grid cell`.,http://rs.tdwg.org/dwc/terms/,2017-10-06,recommended,http://rs.tdwg.org/dwc/terms/version/dataGeneralizations-2017-10-06,http://www.w3.org/1999/02/22-rdf-syntax-ns#Property,http://rs.tdwg.org/dwc/terms/dataGeneralizations,not in ABCD,simple
http://rs.tdwg.org/dwc/terms/version/dynamicProperties-2018-09-06,dynamicProperties,"A list of additional measurements, facts, characteristics, or assertions about the record. Meant to provide a mechanism for structured content.",Recommended best practice is to use a key:value encoding schema for a data interchange format such as JSON.,"`{""heightInMeters"":1.5}`, `{""tragusLengthInMeters"":0.014, ""weightInGrams"":120}`, `{""natureOfID"":""expert identification"", ""identificationEvidence"":""cytochrome B sequence""}`, `{""relativeHumidity"":28, ""airTemperatureInCelsius"":22, ""sampleSizeInKilograms"":10}`, `{""aspectHeading"":277, ""slopeInDegrees"":6}`, `{""iucnStatus"":""vulnerable"", ""taxonDistribution"":""Neuquén, Argentina""}`",http://rs.tdwg.org/dwc/terms/,2017-10-06,recommended,http://rs.tdwg.org/dwc/terms/version/dynamicProperties-2017-10-06,http://www.w3.org/1999/02/22-rdf-syntax-ns#Property,http://rs.tdwg.org/dwc/terms/dynamicProperties,not in ABCD,simple
http://rs.tdwg.org/dwc/terms/version/Occurrence-2018-09-06,Occurrence,An existence of an Organism (sensu http://rs.tdwg.org/dwc/terms/Organism) at a particular place at a particular time.,,A wolf pack on the shore of Kluane Lake in 1988. A virus in a plant leaf in a the New York Botanical Garden at 15:29 on 2014-10-23. A fungus in Central Park in the summer of 1929.,,2014-10-23,recommended,http://rs.tdwg.org/dwc/terms/version/Occurrence-2014-10-23,http://www.w3.org/2000/01/rdf-schema#Class,http://rs.tdwg.org/dwc/terms/Occurrence,DataSets/DataSet/Units/Unit,extension
http://rs.tdwg.org/dwc/terms/version/occurrenceID-2018-09-06,occurrenceID,"An identifier for the Occurrence (as opposed to a particular digital record of the occurrence). In the absence of a persistent global unique identifier, construct one from a combination of identifiers in the record that will most closely make the occurrenceID globally unique.","Recommended best practice is to use a persistent, globally unique identifier.","`http://arctos.database.museum/guid/MSB:Mamm:233627`, `000866d2-c177-4648-a200-ead4007051b9`, `urn:catalog:UWBM:Bird:89776`",http://rs.tdwg.org/dwc/terms/Occurrence,2017-10-06,recommended,http://rs.tdwg.org/dwc/terms/version/occurrenceID-2017-10-06,http://www.w3.org/1999/02/22-rdf-syntax-ns#Property,http://rs.tdwg.org/dwc/terms/occurrenceID,DataSets/DataSet/Units/Unit/UnitGUID,simple
http://rs.tdwg.org/dwc/terms/version/catalogNumber-2018-09-06,catalogNumber,An identifier (preferably unique) for the record within the data set or collection.,,"`145732`, `145732a`, `2008.1334`, `R-4313`",http://rs.tdwg.org/dwc/terms/Occurrence,2017-10-06,recommended,http://rs.tdwg.org/dwc/terms/version/catalogNumber-2017-10-06,http://www.w3.org/1999/02/22-rdf-syntax-ns#Property,http://rs.tdwg.org/dwc/terms/catalogNumber,DataSets/DataSet/Units/Unit/UnitID,simple
http://rs.tdwg.org/dwc/terms/version/recordNumber-2018-09-06,recordNumber,"An identifier given to the Occurrence at the time it was recorded. Often serves as a link between field notes and an Occurrence record, such as a specimen collector's number.",,`OPP 7101`,http://rs.tdwg.org/dwc/terms/Occurrence,2017-10-06,recommended,http://rs.tdwg.org/dwc/terms/version/recordNumber-2017-10-06,http://www.w3.org/1999/02/22-rdf-syntax-ns#Property,http://rs.tdwg.org/dwc/terms/recordNumber,DataSets/DataSet/Units/Unit/CollectorsFieldNumber,simple
http://rs.tdwg.org/dwc/terms/version/recordedBy-2018-09-06,recordedBy,"A list (concatenated and separated) of names of people, groups, or organizations responsible for recording the original Occurrence. The primary collector or observer, especially one who applies a personal identifier (recordNumber), should be listed first.",Recommended best practice is to separate the values in a list with space vertical bar space (` | `).,`José E. Crespo`. `Oliver P. Pearson | Anita K. Pearson` (where the value in recordNumber `OPP 7101` corresponds to the collector number for the specimen in the field catalog of Oliver P. Pearson).,http://rs.tdwg.org/dwc/terms/Occurrence,2017-10-06,recommended,http://rs.tdwg.org/dwc/terms/version/recordedBy-2017-10-06,http://www.w3.org/1999/02/22-rdf-syntax-ns#Property,http://rs.tdwg.org/dwc/terms/recordedBy,DataSets/DataSet/Units/Unit/Gathering/GatheringAgents/GatheringAgentsText,simple
http://rs.tdwg.org/dwc/terms/version/individualCount-2018-09-06,individualCount,The number of individuals represented present at the time of the Occurrence.,,"`0`, `1`, `25`",http://rs.tdwg.org/dwc/terms/Occurrence,2017-10-06,recommended,http://rs.tdwg.org/dwc/terms/version/individualCount-2017-10-06,http://www.w3.org/1999/02/22-rdf-syntax-ns#Property,http://rs.tdwg.org/dwc/terms/individualCount,DataSets/DataSet/Units/Unit/Gathering/SiteMeasurementsOrFacts/SiteMeasurementOrFact/MeasurementOrFactAtomised/LowerValue,simple
http://rs.tdwg.org/dwc/terms/version/organismQuantity-2018-09-06,organismQuantity,A number or enumeration value for the quantity of organisms.,A dwc:organismQuantity must have a corresponding dwc:organismQuantityType.,`27` (organismQuantity) with `individuals` (organismQuantityType). `12.5` (organismQuantity) with `%biomass` (organismQuantityType). `r` (organismQuantity) with `BraunBlanquetScale` (organismQuantityType).,http://rs.tdwg.org/dwc/terms/Occurrence,2017-10-06,recommended,http://rs.tdwg.org/dwc/terms/version/organismQuantity-2017-10-06,http://www.w3.org/1999/02/22-rdf-syntax-ns#Property,http://rs.tdwg.org/dwc/terms/organismQuantity,not in ABCD,simple
http://rs.tdwg.org/dwc/terms/version/organismQuantityType-2018-09-06,organismQuantityType,The type of quantification system used for the quantity of organisms.,A dwc:organismQuantityType must have a corresponding dwc:organismQuantity.,`27` (organismQuantity) with `individuals` (organismQuantityType). `12.5` (organismQuantity) with `%biomass` (organismQuantityType). `r` (organismQuantity) with `BraunBlanquetScale` (organismQuantityType).,http://rs.tdwg.org/dwc/terms/Occurrence,2017-10-06,recommended,http://rs.tdwg.org/dwc/terms/version/organismQuantityType-2017-10-06,http://www.w3.org/1999/02/22-rdf-syntax-ns#Property,http://rs.tdwg.org/dwc/terms/organismQuantityType,not in ABCD,simple
http://rs.tdwg.org/dwc/terms/version/sex-2018-09-06,sex,The sex of the biological individual(s) represented in the Occurrence.,Recommended best practice is to use a controlled vocabulary.,"`female`, `male`, `hermaphrodite`",http://rs.tdwg.org/dwc/terms/Occurrence,2017-10-06,recommended,http://rs.tdwg.org/dwc/terms/version/sex-2017-10-06,http://www.w3.org/1999/02/22-rdf-syntax-ns#Property,http://rs.tdwg.org/dwc/terms/sex,DataSets/DataSet/Units/Unit/Sex,simple
http://rs.tdwg.org/dwc/terms/version/lifeStage-2018-09-06,lifeStage,The age class or life stage of the biological individual(s) at the time the Occurrence was recorded.,Recommended best practice is to use a controlled vocabulary.,"`egg`, `eft`, `juvenile`, `adult`",http://rs.tdwg.org/dwc/terms/Occurrence,2017-10-06,recommended,http://rs.tdwg.org/dwc/terms/version/lifeStage-2017-10-06,http://www.w3.org/1999/02/22-rdf-syntax-ns#Property,http://rs.tdwg.org/dwc/terms/lifeStage,"DataSets/DataSet/Units/Unit/MycologicalUnit/MycologicalSexualStage or DataSets/DataSet/Units/Unit/MycologicalUnit/MycologicalLiveStages/MycologicalLiveStage (Note DwC spec uses ""MycologicalLifeStage"" or DataSets/DataSet/Units/Unit/ZoologicalUnit/PhasesOrStages/PhaseOrStage",simple
http://rs.tdwg.org/dwc/terms/version/reproductiveCondition-2018-09-06,reproductiveCondition,The reproductive condition of the biological individual(s) represented in the Occurrence.,Recommended best practice is to use a controlled vocabulary.,"`non-reproductive`, `pregnant`, `in bloom`, `fruit-bearing`",http://rs.tdwg.org/dwc/terms/Occurrence,2017-10-06,recommended,http://rs.tdwg.org/dwc/terms/version/reproductiveCondition-2017-10-06,http://www.w3.org/1999/02/22-rdf-syntax-ns#Property,http://rs.tdwg.org/dwc/terms/reproductiveCondition,not in ABCD,simple
http://rs.tdwg.org/dwc/terms/version/behavior-2018-09-06,behavior,The behavior shown by the subject at the time the Occurrence was recorded.,,"`roosting`, `foraging`, `running`",http://rs.tdwg.org/dwc/terms/Occurrence,2017-10-06,recommended,http://rs.tdwg.org/dwc/terms/version/behavior-2017-10-06,http://www.w3.org/1999/02/22-rdf-syntax-ns#Property,http://rs.tdwg.org/dwc/terms/behavior,not in ABCD,simple
http://rs.tdwg.org/dwc/terms/version/establishmentMeans-2018-09-06,establishmentMeans,The process by which the biological individual(s) represented in the Occurrence became established at the location.,Recommended best practice is to use a controlled vocabulary.,"`native`, `introduced`, `naturalised`, `invasive`, `managed`",http://rs.tdwg.org/dwc/terms/Occurrence,2017-10-06,recommended,http://rs.tdwg.org/dwc/terms/version/establishmentMeans-2017-10-06,http://www.w3.org/1999/02/22-rdf-syntax-ns#Property,http://rs.tdwg.org/dwc/terms/establishmentMeans,DataSets/DataSet/Units/Unit/Gathering/EstablishmentMeans,simple
http://rs.tdwg.org/dwc/terms/version/occurrenceStatus-2018-09-06,occurrenceStatus,A statement about the presence or absence of a Taxon at a Location.,Recommended best practice is to use a controlled vocabulary.,"`present`, `absent`",http://rs.tdwg.org/dwc/terms/Occurrence,2017-10-06,recommended,http://rs.tdwg.org/dwc/terms/version/occurrenceStatus-2017-10-06,http://www.w3.org/1999/02/22-rdf-syntax-ns#Property,http://rs.tdwg.org/dwc/terms/occurrenceStatus,not in ABCD,simple
http://rs.tdwg.org/dwc/terms/version/preparations-2018-09-06,preparations,A list (concatenated and separated) of preparations and preservation methods for a specimen.,Recommended best practice is to separate the values in a list with space vertical bar space (` | `).,"`fossil`, `cast`, `photograph`, `DNA extract`, `skin | skull | skeleton`, `whole animal (ETOH) | tissue (EDTA)`",http://rs.tdwg.org/dwc/terms/Occurrence,2017-10-06,recommended,http://rs.tdwg.org/dwc/terms/version/preparations-2017-10-06,http://www.w3.org/1999/02/22-rdf-syntax-ns#Property,http://rs.tdwg.org/dwc/terms/preparations,DataSets/DataSet/Units/Unit/SpecimenUnit/Preparations/PreparationsText,simple
http://rs.tdwg.org/dwc/terms/version/disposition-2018-09-06,disposition,The current state of a specimen with respect to the collection identified in collectionCode or collectionID.,Recommended best practice is to use a controlled vocabulary.,"`in collection`, `missing`, `voucher elsewhere`, `duplicates elsewhere`",http://rs.tdwg.org/dwc/terms/Occurrence,2017-10-06,recommended,http://rs.tdwg.org/dwc/terms/version/disposition-2017-10-06,http://www.w3.org/1999/02/22-rdf-syntax-ns#Property,http://rs.tdwg.org/dwc/terms/disposition,DataSets/DataSet/Units/Unit/SpecimenUnit/Disposition,simple
http://rs.tdwg.org/dwc/terms/version/associatedMedia-2018-09-06,associatedMedia,"A list (concatenated and separated) of identifiers (publication, global unique identifier, URI) of media associated with the Occurrence.",,"`http://arctos.database.museum/SpecimenImages/UAMObs/Mamm/2/P7291179.JPG`, `http://204.140.246.24/Fish/Collection%20Pictures/10118-00.jpg | http://204.140.246.24/Fish/Collection%20Pictures/10118-00a.jpg`",http://rs.tdwg.org/dwc/terms/Occurrence,2017-10-06,recommended,http://rs.tdwg.org/dwc/terms/version/associatedMedia-2017-10-06,http://www.w3.org/1999/02/22-rdf-syntax-ns#Property,http://rs.tdwg.org/dwc/terms/associatedMedia,DataSets/DataSet/Units/Unit/MultimediaObjects,simple
http://rs.tdwg.org/dwc/terms/version/associatedReferences-2018-09-06,associatedReferences,"A list (concatenated and separated) of identifiers (publication, bibliographic reference, global unique identifier, URI) of literature associated with the Occurrence.",,"`http://www.sciencemag.org/cgi/content/abstract/322/5899/261`, `Christopher J. Conroy, Jennifer L. Neuwald. 2008. Phylogeographic study of the California vole, Microtus californicus Journal of Mammalogy, 89(3):755-767.`, `Steven R. Hoofer and Ronald A. Van Den Bussche. 2001. Phylogenetic Relationships of Plecotine Bats and Allies Based on Mitochondrial Ribosomal Sequences. Journal of Mammalogy 82(1):131-137. | Walker, Faith M., Jeffrey T. Foster, Kevin P. Drees, Carol L. Chambers. 2014. Spotted bat (Euderma maculatum) microsatellite discovery using illumina sequencing. Conservation Genetics Resources.`",http://rs.tdwg.org/dwc/terms/Occurrence,2017-10-06,recommended,http://rs.tdwg.org/dwc/terms/version/associatedReferences-2017-10-06,http://www.w3.org/1999/02/22-rdf-syntax-ns#Property,http://rs.tdwg.org/dwc/terms/associatedReferences,DataSets/DataSet/Units/Unit/UnitReferences,simple
http://rs.tdwg.org/dwc/terms/version/associatedSequences-2018-09-06,associatedSequences,"A list (concatenated and separated) of identifiers (publication, global unique identifier, URI) of genetic sequence information associated with the Occurrence.",,"`http://www.ncbi.nlm.nih.gov/nuccore/U34853.1`, `http://www.ncbi.nlm.nih.gov/nuccore/GU328060 | http://www.ncbi.nlm.nih.gov/nuccore/AF326093`",http://rs.tdwg.org/dwc/terms/Occurrence,2017-10-06,recommended,http://rs.tdwg.org/dwc/terms/version/associatedSequences-2017-10-06,http://www.w3.org/1999/02/22-rdf-syntax-ns#Property,http://rs.tdwg.org/dwc/terms/associatedSequences,DataSets/DataSet/Units/Unit/Sequences/Sequence/ID-in-Database + constant,simple
http://rs.tdwg.org/dwc/terms/version/associatedTaxa-2018-09-06,associatedTaxa,A list (concatenated and separated) of identifiers or names of taxa and their associations with the Occurrence.,,"`""host"":""Quercus alba""`, `""parasitoid of"":""Cyclocephala signaticollis"" | ""predator of"":""Apis mellifera""`",http://rs.tdwg.org/dwc/terms/Occurrence,2017-10-06,recommended,http://rs.tdwg.org/dwc/terms/version/associatedTaxa-2017-10-06,http://www.w3.org/1999/02/22-rdf-syntax-ns#Property,http://rs.tdwg.org/dwc/terms/associatedTaxa,DataSets/DataSet/Units/Unit/Gathering/Synecology/AssociatedTaxa,simple
http://rs.tdwg.org/dwc/terms/version/otherCatalogNumbers-2018-09-06,otherCatalogNumbers,"A list (concatenated and separated) of previous or alternate fully qualified catalog numbers or other human-used identifiers for the same Occurrence, whether in the current or any other data set or collection.",Recommended best practice is to separate the values in a list with space vertical bar space (` | `).,"`FMNH:Mammal:1234`, `NPS YELLO6778 | MBG 33424`",http://rs.tdwg.org/dwc/terms/Occurrence,2017-10-06,recommended,http://rs.tdwg.org/dwc/terms/version/otherCatalogNumbers-2017-10-06,http://www.w3.org/1999/02/22-rdf-syntax-ns#Property,http://rs.tdwg.org/dwc/terms/otherCatalogNumbers,DataSets/DataSet/Units/Unit/SpecimenUnit/History/PreviousUnitsText,simple
http://rs.tdwg.org/dwc/terms/version/occurrenceRemarks-2018-09-06,occurrenceRemarks,Comments or notes about the Occurrence.,,`found dead on road`,http://rs.tdwg.org/dwc/terms/Occurrence,2017-10-06,recommended,http://rs.tdwg.org/dwc/terms/version/occurrenceRemarks-2017-10-06,http://www.w3.org/1999/02/22-rdf-syntax-ns#Property,http://rs.tdwg.org/dwc/terms/occurrenceRemarks,DataSets/DataSet/Units/Unit/Notes,simple
