iri,label,definition,comments,examples,organized_in,issued,status,replaces,rdf_type,term_iri,abcd_equivalence,flags
http://rs.tdwg.org/dwc/terms/version/organismQuantity-2014-12-23,Organism Quantity,A number or enumeration value for the quantity of organisms.,"An organismQuantity must have a corresponding organismQuantityType. Examples: `27` (organismQuantity) with `individuals` (organismQuantityType), `12.5` (organismQuantity) with `%biomass` (organismQuantityType), `r` (organismQuantity) with `BraunBlanquetScale` (organismQuantityType). For discussion see http://terms.tdwg.org/wiki/dwc:organismQuantity.",,http://rs.tdwg.org/dwc/terms/Occurrence,2014-12-23,superseded,,http://www.w3.org/1999/02/22-rdf-syntax-ns#Property,http://rs.tdwg.org/dwc/terms/organismQuantity,not in ABCD,simple
http://rs.tdwg.org/dwc/terms/version/organismQuantityType-2014-12-23,Organism Quantity Type,The type of quantification system used for the quantity of organisms.,"An organismQuantityType must have a corresponding organismQuantity. Examples: `27` (organismQuantity) with `individuals` (organismQuantityType), `12.5` (organismQuantity) with `%biomass` (organismQuantityType), `r` (organismQuantity) with `BraunBlanquetScale` (organismQuantityType). For discussion see http://terms.tdwg.org/wiki/dwc:organismQuantityType.",,http://rs.tdwg.org/dwc/terms/Occurrence,2014-12-23,superseded,,http://www.w3.org/1999/02/22-rdf-syntax-ns#Property,http://rs.tdwg.org/dwc/terms/organismQuantityType,not in ABCD,simple
http://rs.tdwg.org/dwc/terms/version/organismRemarks-2014-10-23,Organism Remarks,Comments or notes about the Organism instance.,Example: `One of a litter of six`. For discussion see http://terms.tdwg.org/wiki/dwc:organismRemarks.,,http://rs.tdwg.org/dwc/terms/Organism,2014-10-23,superseded,,http://www.w3.org/1999/02/22-rdf-syntax-ns#Property,http://rs.tdwg.org/dwc/terms/organismRemarks,not in ABCD,simple
http://rs.tdwg.org/dwc/terms/version/organismScope-2014-10-23,Organism Scope,A description of the kind of Organism instance. Can be used to indicate whether the Organism instance represents a discrete organism or if it represents a particular type of aggregation. Recommended best practice is to use a controlled vocabulary.,"Recommended best practice is to use a controlled vocabulary. This term is not intended to be used to specify a type of taxon. To describe the kind of Organism using a URI object in RDF, use rdf:type (http://www.w3.org/1999/02/22-rdf-syntax-ns#type) instead. Examples: `multicellular organism`, `virus`, `clone` `pack`, `colony`. For discussion see http://terms.tdwg.org/wiki/dwc:organismScope.",,http://rs.tdwg.org/dwc/terms/Organism,2014-10-23,superseded,,http://www.w3.org/1999/02/22-rdf-syntax-ns#Property,http://rs.tdwg.org/dwc/terms/organismScope,not in ABCD,simple
http://rs.tdwg.org/dwc/terms/version/originalNameUsage-2009-09-21,Original Name Usage,"The taxon name, with authorship and date information if known, as it originally appeared when first established under the rules of the associated nomenclaturalCode. The basionym (botany) or basonym (bacteriology) of the scientificName or the senior/earlier homonym for replaced names.","Examples: `Pinus abies`, `Gasterosteus saltatrix Linnaeus 1768`. For discussion see http://terms.tdwg.org/wiki/dwc:originalNameUsage.",,http://rs.tdwg.org/dwc/terms/Taxon,2009-09-21,superseded,http://rs.tdwg.org/dwc/terms/version/basionym-2009-04-24,http://www.w3.org/1999/02/22-rdf-syntax-ns#Property,http://rs.tdwg.org/dwc/terms/originalNameUsage,not in ABCD,simple
http://rs.tdwg.org/dwc/terms/version/originalNameUsageID-2009-09-21,Original Name Usage ID,An identifier for the name usage (documented meaning of the name according to a source) in which the terminal element of the scientificName was originally established under the rules of the associated nomenclaturalCode.,Example: `http://species.gbif.org/abies_alba_1753`. For discussion see http://terms.tdwg.org/wiki/dwc:originalNameUsageID.,,http://rs.tdwg.org/dwc/terms/Taxon,2009-09-21,superseded,http://rs.tdwg.org/dwc/terms/version/basionymID-2009-04-24,http://www.w3.org/1999/02/22-rdf-syntax-ns#Property,http://rs.tdwg.org/dwc/terms/originalNameUsageID,not in ABCD,simple
http://rs.tdwg.org/dwc/terms/version/otherCatalogNumbers-2009-04-24,Other Catalog Numbers,"A list (concatenated and separated) of previous or alternate fully qualified catalog numbers or other human-used identifiers for the same Occurrence, whether in the current or any other data set or collection.","Recommended best practice is to separate the values with a vertical bar (` | `). Examples: `FMNH:Mammal:1234`, `NPS YELLO6778 | MBG 33424`. For discussion see http://terms.tdwg.org/wiki/dwc:otherCatalogNumbers.",,http://rs.tdwg.org/dwc/terms/Occurrence,2009-04-24,superseded,http://rs.tdwg.org/dwc/curatorial/version/OtherCatalogNumbers-2007-04-17,http://www.w3.org/1999/02/22-rdf-syntax-ns#Property,http://rs.tdwg.org/dwc/terms/otherCatalogNumbers,DataSets/DataSet/Units/Unit/SpecimenUnit/History/PreviousUnitsText,simple
http://rs.tdwg.org/dwc/terms/version/otherCatalogNumbers-2014-10-23,Other Catalog Numbers,"A list (concatenated and separated) of previous or alternate fully qualified catalog numbers or other human-used identifiers for the same Occurrence, whether in the current or any other data set or collection.","Recommended best practice is to separate the values with a vertical bar (` | `). Examples: `FMNH:Mammal:1234`, `NPS YELLO6778 | MBG 33424`. For discussion see http://terms.tdwg.org/wiki/dwc:otherCatalogNumbers.",,http://rs.tdwg.org/dwc/terms/Occurrence,2014-10-23,superseded,http://rs.tdwg.org/dwc/terms/version/otherCatalogNumbers-2009-04-24,http://www.w3.org/1999/02/22-rdf-syntax-ns#Property,http://rs.tdwg.org/dwc/terms/otherCatalogNumbers,DataSets/DataSet/Units/Unit/SpecimenUnit/History/PreviousUnitsText,simple
http://rs.tdwg.org/dwc/terms/version/ownerInstitutionCode-2009-08-24,Owner Institution Code,The name (or acronym) in use by the institution having ownership of the object(s) or information referred to in the record.,"Examples: `NPS`, `APN`, `InBio`. For discussion see http://terms.tdwg.org/wiki/dwc:ownerInstitutionCode.",,http://rs.tdwg.org/dwc/terms/,2009-08-24,superseded,,http://www.w3.org/1999/02/22-rdf-syntax-ns#Property,http://rs.tdwg.org/dwc/terms/ownerInstitutionCode,not in ABCD,simple
http://rs.tdwg.org/dwc/terms/version/parentEventID-2014-12-23,Parent Event ID,An identifier for the broader Event that groups this and potentially other Events.,"May be a globally unique identifier or an identifier specific to the data set. Example: `A1` as parentEventID to identify the main Whittaker Plot in nested samples, each with its own eventID (e.g., `A1:1`, `A1:2`). For discussion see http://terms.tdwg.org/wiki/dwc:parentEventID.",,http://rs.tdwg.org/dwc/terms/Event,2014-12-23,superseded,,http://www.w3.org/1999/02/22-rdf-syntax-ns#Property,http://rs.tdwg.org/dwc/terms/parentEventID,not in ABCD,simple
http://rs.tdwg.org/dwc/terms/version/parentNameUsage-2009-09-21,Parent Name Usage,"The full name, with authorship and date information if known, of the direct, most proximate higher-rank parent taxon (in a classification) of the most specific element of the scientificName.","Examples: `Rubiaceae`, `Gruiformes`, `Testudinae`. For discussion see http://terms.tdwg.org/wiki/dwc:parentNameUsage.",,http://rs.tdwg.org/dwc/terms/Taxon,2009-09-21,superseded,,http://www.w3.org/1999/02/22-rdf-syntax-ns#Property,http://rs.tdwg.org/dwc/terms/parentNameUsage,DataSets/DataSet/Units/Unit/Identifications/Identification/TaxonIdentified/HigherTaxa/HigherTaxon/HigherTaxonName,simple
http://rs.tdwg.org/dwc/terms/version/parentNameUsageID-2009-09-21,Parent Name Usage ID,"An identifier for the name usage (documented meaning of the name according to a source) of the direct, most proximate higher-rank parent taxon (in a classification) of the most specific element of the scientificName.",Example: `8fa58e08-08de-4ac1-b69c-1235340b7001`. For discussion see http://terms.tdwg.org/wiki/dwc:parentNameUsageID.,,http://rs.tdwg.org/dwc/terms/Taxon,2009-09-21,superseded,http://rs.tdwg.org/dwc/terms/version/higherTaxonNameID-2009-04-24,http://www.w3.org/1999/02/22-rdf-syntax-ns#Property,http://rs.tdwg.org/dwc/terms/parentNameUsageID,not in ABCD,simple
http://rs.tdwg.org/dwc/terms/version/phylum-2009-04-24,Phylum,The name of the phlyum (or division) in which the scientificName is classified.,"Examples: `Chordata` (phylum), `Bryophyta` (division). For discussion see http://terms.tdwg.org/wiki/dwc:phylum.",,http://rs.tdwg.org/dwc/terms/Taxon,2009-04-24,superseded,http://rs.tdwg.org/dwc/dwcore/version/Phylum-2007-04-17,http://www.w3.org/1999/02/22-rdf-syntax-ns#Property,http://rs.tdwg.org/dwc/terms/phylum,DataSets/DataSet/Units/Unit/Identifications/Identification/TaxonIdentified/HigherTaxa/HigherTaxon/HigherTaxonName with HigherTaxa/HigherTaxon/HigherTaxonRank = phylum,simple
http://rs.tdwg.org/dwc/terms/version/phylum-2009-08-24,Phylum,The full scientific name of the phylum or division in which the taxon is classified.,"Examples: `Chordata` (phylum), `Bryophyta` (division). For discussion see http://terms.tdwg.org/wiki/dwc:phylum.",,http://rs.tdwg.org/dwc/terms/Taxon,2009-08-24,superseded,http://rs.tdwg.org/dwc/terms/version/phylum-2009-04-24,http://www.w3.org/1999/02/22-rdf-syntax-ns#Property,http://rs.tdwg.org/dwc/terms/phylum,DataSets/DataSet/Units/Unit/Identifications/Identification/TaxonIdentified/HigherTaxa/HigherTaxon/HigherTaxonName with HigherTaxa/HigherTaxon/HigherTaxonRank = phylum,simple
http://rs.tdwg.org/dwc/terms/version/pointRadiusSpatialFit-2009-04-24,Point Radius Spatial Fit,"The ratio of the area of the point-radius (decimalLatitude, decimalLongitude, coordinateUncertaintyInMeters) to the area of the true (original, or most specific) spatial representation of the Location. Legal values are 0, greater than or equal to 1, or undefined. A value of 1 is an exact match or 100% overlap. A value of 0 should be used if the given point-radius does not completely contain the original representation. The pointRadiusSpatialFit is undefined (and should be left blank) if the original representation is a point without uncertainty and the given georeference is not that same point (without uncertainty). If both the original and the given georeference are the same point, the pointRadiusSpatialFit is 1.","Detailed explanations with graphical examples can be found in the Guide to Best Practices for Georeferencing, Chapman and Wieczorek, eds. 2006. For discussion see http://terms.tdwg.org/wiki/dwc:pointRadiusSpatialFit.",,http://purl.org/dc/terms/Location,2009-04-24,superseded,http://rs.tdwg.org/dwc/geospatial/version/PointRadiusSpatialFit-2007-04-17,http://www.w3.org/1999/02/22-rdf-syntax-ns#Property,http://rs.tdwg.org/dwc/terms/pointRadiusSpatialFit,DataSets/DataSet/Units/Unit/Gathering/SiteCoordinateSets/SiteCoordinates/PointRadiusSpatialFit,simple
http://rs.tdwg.org/dwc/terms/version/preparations-2009-04-24,Preparations,A list (concatenated and separated) of preparations and preservation methods for a specimen.,"Recommended best practice is to separate the values with a vertical bar (` | `). Examples: `fossil`, `cast`, `photograph`, `DNA extract`, `skin | skull | skeleton`, `whole animal (ETOH) | tissue (EDTA)`. For discussion see http://terms.tdwg.org/wiki/dwc:preparations.",,http://rs.tdwg.org/dwc/terms/Occurrence,2009-04-24,superseded,http://rs.tdwg.org/dwc/curatorial/version/Preparations-2007-04-17,http://www.w3.org/1999/02/22-rdf-syntax-ns#Property,http://rs.tdwg.org/dwc/terms/preparations,DataSets/DataSet/Units/Unit/SpecimenUnit/Preparations/PreparationsText,simple
http://rs.tdwg.org/dwc/terms/version/preparations-2014-10-23,Preparations,A list (concatenated and separated) of preparations and preservation methods for a specimen.,"Recommended best practice is to separate the values with a vertical bar (` | `). Examples: `fossil`, `cast`, `photograph`, `DNA extract`, `skin | skull | skeleton`, `whole animal (ETOH) | tissue (EDTA)`. For discussion see http://terms.tdwg.org/wiki/dwc:preparations.",,http://rs.tdwg.org/dwc/terms/Occurrence,2014-10-23,superseded,http://rs.tdwg.org/dwc/terms/version/preparations-2009-04-24,http://www.w3.org/1999/02/22-rdf-syntax-ns#Property,http://rs.tdwg.org/dwc/terms/preparations,DataSets/DataSet/Units/Unit/SpecimenUnit/Preparations/PreparationsText,simple
http://rs.tdwg.org/dwc/terms/version/PreservedSpecimen-2014-10-23,Preserved Specimen,A specimen that has been preserved.,For discussion see http://terms.tdwg.org/wiki/dwc:PreservedSpecimen.,,,2014-10-23,superseded,http://rs.tdwg.org/dwc/dwctype/version/PreservedSpecimen-2011-10-16,http://www.w3.org/2000/01/rdf-schema#Class,http://rs.tdwg.org/dwc/terms/PreservedSpecimen,RecordBasisEnum/PreservedSpecimen,
http://rs.tdwg.org/dwc/terms/version/PreviousIdentifications-2008-11-19,Previous Identifications,A list (concatenated and separated) of previous ScientificNames to which the sample was identified.,,,,2008-11-19,deprecated,,http://www.w3.org/1999/02/22-rdf-syntax-ns#Property,http://rs.tdwg.org/dwc/terms/PreviousIdentifications,,
http://rs.tdwg.org/dwc/terms/version/previousIdentifications-2009-04-24,Previous Identifications,A list (concatenated and separated) of previous assignments of names to the subject.,"Recommended best practice is to separate the values with a vertical bar (` | `). Examples: `Chalepidae`, `Pinus abies`, `Anthus sp., field ID by G. Iglesias | Anthus correndera, expert ID by C. Cicero 2009-02-12 based on morphology`. For discussion see http://terms.tdwg.org/wiki/dwc:previousIdentifications.",,http://rs.tdwg.org/dwc/terms/Organism,2009-04-24,superseded,http://rs.tdwg.org/dwc/terms/version/PreviousIdentifications-2008-11-19,http://www.w3.org/1999/02/22-rdf-syntax-ns#Property,http://rs.tdwg.org/dwc/terms/previousIdentifications,DataSets/DataSet/Units/Unit/Identifications/Identification with PreferredFlag = false,simple
http://rs.tdwg.org/dwc/terms/version/previousIdentifications-2009-05-18,Previous Identifications,A list (concatenated and separated) of previous assignments of names to the Occurrence.,"Recommended best practice is to separate the values with a vertical bar (` | `). Examples: `Chalepidae`, `Pinus abies`, `Anthus sp., field ID by G. Iglesias | Anthus correndera, expert ID by C. Cicero 2009-02-12 based on morphology`. For discussion see http://terms.tdwg.org/wiki/dwc:previousIdentifications.",,http://rs.tdwg.org/dwc/terms/Organism,2009-05-18,superseded,http://rs.tdwg.org/dwc/terms/version/previousIdentifications-2009-04-24,http://www.w3.org/1999/02/22-rdf-syntax-ns#Property,http://rs.tdwg.org/dwc/terms/previousIdentifications,DataSets/DataSet/Units/Unit/Identifications/Identification with PreferredFlag = false,simple
http://rs.tdwg.org/dwc/terms/version/previousIdentifications-2014-10-23,Previous Identifications,A list (concatenated and separated) of previous assignments of names to the Organism.,"Recommended best practice is to separate the values with a vertical bar (` | `). Examples: `Chalepidae`, `Pinus abies`, `Anthus sp., field ID by G. Iglesias | Anthus correndera, expert ID by C. Cicero 2009-02-12 based on morphology`. For discussion see http://terms.tdwg.org/wiki/dwc:previousIdentifications.",,http://rs.tdwg.org/dwc/terms/Organism,2014-10-23,superseded,http://rs.tdwg.org/dwc/terms/version/previousIdentifications-2009-05-18,http://www.w3.org/1999/02/22-rdf-syntax-ns#Property,http://rs.tdwg.org/dwc/terms/previousIdentifications,DataSets/DataSet/Units/Unit/Identifications/Identification with PreferredFlag = false,simple
http://rs.tdwg.org/dwc/terms/version/recordedBy-2009-04-24,Recorded By,"A list (concatenated and separated) of names of people, groups, or organizations responsible for recording the original Occurrence. The primary collector or observer, especially one who applies a personal identifier (recordNumber), should be listed first.","Recommended best practice is to separate the values with a vertical bar (` | `). The primary collector or observer, especially one who applies a personal identifier (recordNumber), should be listed first. Examples: `José E. Crespo`, `Oliver P. Pearson | Anita K. Pearson` where the value in recordNumber `OPP 7101` corresponds to the number for the specimen in the field catalog (collector number) of Oliver P. Pearson. For discussion see http://terms.tdwg.org/wiki/dwc:recordedBy.",,http://rs.tdwg.org/dwc/terms/Occurrence,2009-04-24,superseded,http://rs.tdwg.org/dwc/dwcore/version/Collector-2007-04-17,http://www.w3.org/1999/02/22-rdf-syntax-ns#Property,http://rs.tdwg.org/dwc/terms/recordedBy,DataSets/DataSet/Units/Unit/Gathering/GatheringAgents/GatheringAgentsText,simple
http://rs.tdwg.org/dwc/terms/version/recordedBy-2014-10-23,Recorded By,"A list (concatenated and separated) of names of people, groups, or organizations responsible for recording the original Occurrence. The primary collector or observer, especially one who applies a personal identifier (recordNumber), should be listed first.","Recommended best practice is to separate the values with a vertical bar (` | `). The primary collector or observer, especially one who applies a personal identifier (recordNumber), should be listed first. Examples: `José E. Crespo`, `Oliver P. Pearson | Anita K. Pearson` where the value in recordNumber `OPP 7101` corresponds to the number for the specimen in the field catalog (collector number) of Oliver P. Pearson. For discussion see http://terms.tdwg.org/wiki/dwc:recordedBy.",,http://rs.tdwg.org/dwc/terms/Occurrence,2014-10-23,superseded,http://rs.tdwg.org/dwc/terms/version/recordedBy-2009-04-24,http://www.w3.org/1999/02/22-rdf-syntax-ns#Property,http://rs.tdwg.org/dwc/terms/recordedBy,DataSets/DataSet/Units/Unit/Gathering/GatheringAgents/GatheringAgentsText,simple
http://rs.tdwg.org/dwc/terms/version/recordNumber-2009-04-24,Record Number,"An identifier given to the Occurrence at the time it was recorded. Often serves as a link between field notes and an Occurrence record, such as a specimen collector's number.",Example: `OPP 7101`. For discussion see http://terms.tdwg.org/wiki/dwc:recordNumber.,,http://rs.tdwg.org/dwc/terms/Occurrence,2009-04-24,superseded,http://rs.tdwg.org/dwc/curatorial/version/CollectorNumber-2007-04-17,http://www.w3.org/1999/02/22-rdf-syntax-ns#Property,http://rs.tdwg.org/dwc/terms/recordNumber,DataSets/DataSet/Units/Unit/CollectorsFieldNumber,simple
http://rs.tdwg.org/dwc/terms/version/RelatedBasisOfRecord-2008-11-19,Related Basis of Record,The nature of the related resource. Recommended best practice is to use the same controlled vocabulary as for basisOfRecord.,,,,2008-11-19,deprecated,,http://www.w3.org/1999/02/22-rdf-syntax-ns#Property,http://rs.tdwg.org/dwc/terms/RelatedBasisOfRecord,,
http://rs.tdwg.org/dwc/terms/version/relatedResourceID-2009-04-24,Related Resource ID,"An identifier for a related resource (the object, rather than the subject of the relationship).",For discussion see http://terms.tdwg.org/wiki/dwc:relatedResourceID.,,http://rs.tdwg.org/dwc/terms/ResourceRelationship,2009-04-24,superseded,,http://www.w3.org/1999/02/22-rdf-syntax-ns#Property,http://rs.tdwg.org/dwc/terms/relatedResourceID,DataSets/DataSet/Units/Unit/Associations/UnitAssociation/AssociatedUnitSourceInstitutionCode + DataSets/DataSet/Units/Unit/Associations/UnitAssociation/AssociatedUnitSourceName + DataSets/DataSet/Units/Unit/Associations/UnitAssociation/AssociatedUnitID,
http://rs.tdwg.org/dwc/terms/version/relatedResourceType-2009-04-24,Related Resource Type,The type of the related resource. Recommended best practice is to use a controlled vocabulary.,,,,2009-04-24,deprecated,,http://www.w3.org/1999/02/22-rdf-syntax-ns#Property,http://rs.tdwg.org/dwc/terms/relatedResourceType,,
http://rs.tdwg.org/dwc/terms/version/relationshipAccordingTo-2009-04-24,Relationship According To,"The source (person, organization, publication, reference) establishing the relationship between the two resources.",Example: `Julie Woodruff`. For discussion see http://terms.tdwg.org/wiki/dwc:relationshipAccordingTo.,,http://rs.tdwg.org/dwc/terms/ResourceRelationship,2009-04-24,superseded,,http://www.w3.org/1999/02/22-rdf-syntax-ns#Property,http://rs.tdwg.org/dwc/terms/relationshipAccordingTo,not in ABCD,
http://rs.tdwg.org/dwc/terms/version/relationshipEstablishedDate-2009-04-24,Relationship Established Date,"The date-time on which the relationship between the two resources was established. Recommended best practice is to use an encoding scheme, such as ISO 8601:2004(E).","Recommended best practice is to use an encoding scheme, such as ISO 8601:2004(E). Examples: `1963-03-08T14:07-0600` is 8 Mar 1963 2:07pm in the time zone six hours earlier than UTC, `2009-02-20T08:40Z` is 20 Feb 2009 8:40am UTC, `1809-02-12` is 12 Feb 1809, `1906-06` is Jun 1906, `1971` is just that year, `2007-03-01T13:00:00Z/2008-05-11T15:30:00Z` is the interval between 1 Mar 2007 1pm UTC and 11 May 2008 3:30pm UTC, `2007-11-13/15` is the interval between 13 Nov 2007 and 15 Nov 2007. For discussion see http://terms.tdwg.org/wiki/dwc:relationshipEstablishedDate.",,http://rs.tdwg.org/dwc/terms/ResourceRelationship,2009-04-24,superseded,,http://www.w3.org/1999/02/22-rdf-syntax-ns#Property,http://rs.tdwg.org/dwc/terms/relationshipEstablishedDate,not in ABCD,
http://rs.tdwg.org/dwc/terms/version/relationshipOfResource-2009-04-24,Relationship Of Resource,The relationship of the resource identified by relatedResourceID to the subject (optionally identified by the resourceID). Recommended best practice is to use a controlled vocabulary.,"Recommended best practice is to use a controlled vocabulary. Examples: `duplicate of`, `mother of`, `endoparasite of`, `host to`, `sibling of`, `valid synonym of`, `located within`. For discussion see http://terms.tdwg.org/wiki/dwc:relationshipOfResource.",,http://rs.tdwg.org/dwc/terms/ResourceRelationship,2009-04-24,superseded,,http://www.w3.org/1999/02/22-rdf-syntax-ns#Property,http://rs.tdwg.org/dwc/terms/relationshipOfResource,DataSets/DataSet/Units/Unit/Associations/UnitAssociation/AssociationType,
http://rs.tdwg.org/dwc/terms/version/relationshipRemarks-2009-04-24,Relationship Remarks,Comments or notes about the relationship between the two resources.,"Examples: `mother and offspring collected from the same nest`, `pollinator captured in the act`. For discussion see http://terms.tdwg.org/wiki/dwc:relationshipRemarks.",,http://rs.tdwg.org/dwc/terms/ResourceRelationship,2009-04-24,superseded,,http://www.w3.org/1999/02/22-rdf-syntax-ns#Property,http://rs.tdwg.org/dwc/terms/relationshipRemarks,DataSets/DataSet/Units/Unit/Associations/UnitAssociation/Comments,
http://rs.tdwg.org/dwc/terms/version/reproductiveCondition-2009-04-24,Reproductive Condition,The reproductive condition of the biological individual(s) represented in the Occurrence. Recommended best practice is to use a controlled vocabulary.,"Recommended best practice is to use a controlled vocabulary. Examples: `non-reproductive`, `pregnant`, `in bloom`, `fruit-bearing`. For discussion see http://terms.tdwg.org/wiki/dwc:reproductiveCondition.",,http://rs.tdwg.org/dwc/terms/Occurrence,2009-04-24,superseded,,http://www.w3.org/1999/02/22-rdf-syntax-ns#Property,http://rs.tdwg.org/dwc/terms/reproductiveCondition,not in ABCD,simple
http://rs.tdwg.org/dwc/terms/version/resourceID-2009-04-24,Resource ID,An identifier for the resource that is the subject of the relationship.,For discussion see http://terms.tdwg.org/wiki/dwc:resourceID.,,http://rs.tdwg.org/dwc/terms/ResourceRelationship,2009-04-24,superseded,,http://www.w3.org/1999/02/22-rdf-syntax-ns#Property,http://rs.tdwg.org/dwc/terms/resourceID,not in ABCD,
http://rs.tdwg.org/dwc/terms/version/ResourceRelationship-2009-01-21,Resource Relationship,"The category of information pertaining to relationships between resources (instances of data records, such as Occurrences, Taxa, Locations, Events).","Resources can be thought of as identifiable records or instances of classes and may include, but need not be limited to Occurrences, Organisms, MaterialSamples, Events, Locations, GeologicalContexts, Identifications, or Taxa. Example: An instance of an Organism is the mother of another instance of an Organism. For discussion see http://terms.tdwg.org/wiki/dwc:ResourceRelationship.",,,2009-01-21,superseded,,http://www.w3.org/2000/01/rdf-schema#Class,http://rs.tdwg.org/dwc/terms/ResourceRelationship,DataSets/DataSet/Units/Unit/Associations,
http://rs.tdwg.org/dwc/terms/version/ResourceRelationship-2014-10-23,Resource Relationship,A relationship of one rdfs:Resource (http://www.w3.org/2000/01/rdf-schema#Resource) to another.,"Resources can be thought of as identifiable records or instances of classes and may include, but need not be limited to Occurrences, Organisms, MaterialSamples, Events, Locations, GeologicalContexts, Identifications, or Taxa. Example: An instance of an Organism is the mother of another instance of an Organism. For discussion see http://terms.tdwg.org/wiki/dwc:ResourceRelationship.",,,2014-10-23,superseded,http://rs.tdwg.org/dwc/terms/version/ResourceRelationship-2009-01-21,http://www.w3.org/2000/01/rdf-schema#Class,http://rs.tdwg.org/dwc/terms/ResourceRelationship,DataSets/DataSet/Units/Unit/Associations,
http://rs.tdwg.org/dwc/terms/version/resourceRelationshipID-2009-04-24,Resource Relationship ID,"An identifier for an instance of relationship between one resource (the subject) and another (relatedResource, the object).",For discussion see http://terms.tdwg.org/wiki/dwc:resourceRelationshipID.,,http://rs.tdwg.org/dwc/terms/ResourceRelationship,2009-04-24,superseded,,http://www.w3.org/1999/02/22-rdf-syntax-ns#Property,http://rs.tdwg.org/dwc/terms/resourceRelationshipID,not in ABCD,
