iri,label,definition,comments,examples,organized_in,issued,status,replaces,rdf_type,term_iri,abcd_equivalence,flags
http://rs.tdwg.org/dwc/iri/version/verbatimCoordinateSystem-2015-03-27,verbatimCoordinateSystem,The spatial coordinate system for the verbatimLatitude and verbatimLongitude or the verbatimCoordinates of the Location.,Recommended best practice is to use a controlled vocabulary. Terms in the dwciri namespace are intended to be used in RDF with non-literal objects.,,http://rs.tdwg.org/dwc/terms/attributes/UseWithIRI,2015-03-27,recommended,,http://www.w3.org/1999/02/22-rdf-syntax-ns#Property,http://rs.tdwg.org/dwc/iri/verbatimCoordinateSystem,not in ABCD,
http://rs.tdwg.org/dwc/iri/version/verbatimSRS-2015-03-27,verbatimSRS,"The ellipsoid, geodetic datum, or spatial reference system (SRS) upon which coordinates given in verbatimLatitude and verbatimLongitude, or verbatimCoordinates are based.","Recommended best practice is to use an IRI for the EPSG code of the SRS, if known. Otherwise use an IRI or controlled vocabulary for the name or code of the geodetic datum, if known. Otherwise use an IRI or controlled vocabulary for the name or code of the ellipsoid, if known. If none of these is known, use the value `unknown`.","`EPSG:4326`, `WGS84`, `NAD27`, `Campo Inchauspe`, `European 1950`, `Clarke 1866`, `unknown`",http://rs.tdwg.org/dwc/terms/attributes/UseWithIRI,2015-03-27,recommended,,http://www.w3.org/1999/02/22-rdf-syntax-ns#Property,http://rs.tdwg.org/dwc/iri/verbatimSRS,not in ABCD,
http://rs.tdwg.org/dwc/terms/version/LivingSpecimen-2018-09-06,LivingSpecimen,A specimen that is alive.,,A living plant in a botanical garden. A living animal in a zoo.,,2017-10-06,recommended,http://rs.tdwg.org/dwc/terms/version/LivingSpecimen-2017-10-06,http://www.w3.org/2000/01/rdf-schema#Class,http://rs.tdwg.org/dwc/terms/LivingSpecimen,RecordBasisEnum/LivingSpecimen,extension
http://rs.tdwg.org/dwc/terms/version/PreservedSpecimen-2018-09-06,PreservedSpecimen,A specimen that has been preserved.,,A plant on an herbarium sheet. A cataloged lot of fish in a jar.,,2017-10-06,recommended,http://rs.tdwg.org/dwc/terms/version/PreservedSpecimen-2017-10-06,http://www.w3.org/2000/01/rdf-schema#Class,http://rs.tdwg.org/dwc/terms/PreservedSpecimen,RecordBasisEnum/PreservedSpecimen,extension
http://rs.tdwg.org/dwc/terms/version/FossilSpecimen-2018-09-06,FossilSpecimen,A preserved specimen that is a fossil.,,A body fossil. A coprolite. A gastrolith. An ichnofossil. A piece of a petrified tree.,,2017-10-06,recommended,http://rs.tdwg.org/dwc/terms/version/FossilSpecimen-2017-10-06,http://www.w3.org/2000/01/rdf-schema#Class,http://rs.tdwg.org/dwc/terms/FossilSpecimen,RecordBasisEnum/FossileSpecimen,extension
http://rs.tdwg.org/dwc/terms/version/HumanObservation-2018-09-06,HumanObservation,An output of a human observation process.,,Evidence of an Occurrence taken from field notes or literature. A record of an Occurrence without physical evidence nor evidence captured with a machine. ,,2017-10-06,recommended,http://rs.tdwg.org/dwc/terms/version/HumanObservation-2017-10-06,http://www.w3.org/2000/01/rdf-schema#Class,http://rs.tdwg.org/dwc/terms/HumanObservation,RecordBasisEnum/HumanObservation,extension
http://rs.tdwg.org/dwc/terms/version/MachineObservation-2018-09-06,MachineObservation,An output of a machine observation process.,,A photograph. A video. An audio recording. A remote sensing image. A Occurrence record based on telemetry.,,2017-10-06,recommended,http://rs.tdwg.org/dwc/terms/version/MachineObservation-2017-10-06,http://www.w3.org/2000/01/rdf-schema#Class,http://rs.tdwg.org/dwc/terms/MachineObservation,RecordBasisEnum/MachineObservation,extension
http://rs.tdwg.org/dwc/terms/version/acceptedNameUsage-2009-09-21,Accepted Name Usage,"The full name, with authorship and date information if known, of the currently valid (zoological) or accepted (botanical) taxon.",Example: `Tamias minimus` valid name for `Eutamias minimus`. For discussion see http://terms.tdwg.org/wiki/dwc:acceptedNameUsage.,,http://rs.tdwg.org/dwc/terms/Taxon,2009-09-21,superseded,http://rs.tdwg.org/dwc/terms/version/acceptedScientificName-2009-07-06,http://www.w3.org/1999/02/22-rdf-syntax-ns#Property,http://rs.tdwg.org/dwc/terms/acceptedNameUsage,not in ABCD,simple
http://rs.tdwg.org/dwc/terms/version/acceptedNameUsageID-2009-09-21,Accepted Name Usage ID,An identifier for the name usage (documented meaning of the name according to a source) of the currently valid (zoological) or accepted (botanical) taxon.,Example: `8fa58e08-08de-4ac1-b69c-1235340b7001`. For discussion see http://terms.tdwg.org/wiki/dwc:acceptedNameUsageID.,,http://rs.tdwg.org/dwc/terms/Taxon,2009-09-21,superseded,http://rs.tdwg.org/dwc/terms/version/acceptedTaxonID-2009-08-24,http://www.w3.org/1999/02/22-rdf-syntax-ns#Property,http://rs.tdwg.org/dwc/terms/acceptedNameUsageID,not in ABCD,simple
http://rs.tdwg.org/dwc/terms/version/acceptedScientificName-2009-07-06,Accepted Scientific Name,The currently valid (zoological) or accepted (botanical) name for the scientificName.,,,,2009-07-06,deprecated,http://rs.tdwg.org/dwc/terms/version/acceptedTaxonName-2009-04-24,http://www.w3.org/1999/02/22-rdf-syntax-ns#Property,http://rs.tdwg.org/dwc/terms/acceptedScientificName,,
http://rs.tdwg.org/dwc/terms/version/acceptedScientificNameID-2009-07-06,Accepted Scientific Name ID,A unique identifier for the acceptedScientificName.,,,,2009-07-06,deprecated,http://rs.tdwg.org/dwc/terms/version/acceptedTaxonNameID-2009-04-24,http://www.w3.org/1999/02/22-rdf-syntax-ns#Property,http://rs.tdwg.org/dwc/terms/acceptedScientificNameID,,
http://rs.tdwg.org/dwc/terms/version/AcceptedTaxon-2008-11-19,Accepted Taxon,The currently valid (zoological) or accepted (botanical) name for the ScientificName.,,,,2008-11-19,deprecated,,http://www.w3.org/1999/02/22-rdf-syntax-ns#Property,http://rs.tdwg.org/dwc/terms/AcceptedTaxon,,
http://rs.tdwg.org/dwc/terms/version/AcceptedTaxonID-2009-01-21,Accepted Taxon ID,A global unique identifier for the parent to the AcceptedTaxon.,,,,2009-01-21,deprecated,,http://www.w3.org/1999/02/22-rdf-syntax-ns#Property,http://rs.tdwg.org/dwc/terms/AcceptedTaxonID,,
http://rs.tdwg.org/dwc/terms/version/acceptedTaxonID-2009-08-24,Accepted Taxon ID,An identifier for the name of the currently valid (zoological) or accepted (botanical) taxon. See acceptedTaxon.,,,,2009-08-24,deprecated,http://rs.tdwg.org/dwc/terms/version/acceptedScientificNameID-2009-07-06,http://www.w3.org/1999/02/22-rdf-syntax-ns#Property,http://rs.tdwg.org/dwc/terms/acceptedTaxonID,,
http://rs.tdwg.org/dwc/terms/version/acceptedTaxonName-2009-04-24,Accepted Taxon Name,The currently valid (zoological) or accepted (botanical) name for the scientificName.,,,,2009-04-24,deprecated,http://rs.tdwg.org/dwc/terms/version/AcceptedTaxon-2008-11-19,http://www.w3.org/1999/02/22-rdf-syntax-ns#Property,http://rs.tdwg.org/dwc/terms/acceptedTaxonName,,
http://rs.tdwg.org/dwc/terms/version/acceptedTaxonNameID-2009-04-24,Accepted Taxon Name ID,A unique identifier for the acceptedTaxonName.,,,,2009-04-24,deprecated,http://rs.tdwg.org/dwc/terms/version/AcceptedTaxonID-2009-01-21,http://www.w3.org/1999/02/22-rdf-syntax-ns#Property,http://rs.tdwg.org/dwc/terms/acceptedTaxonNameID,,
http://rs.tdwg.org/dwc/terms/version/AccessConstraints-2008-11-19,Access Constraints,A description of constraints on the use of the data as shared or access to further data that is not shared.,,,,2008-11-19,deprecated,,http://www.w3.org/1999/02/22-rdf-syntax-ns#Property,http://rs.tdwg.org/dwc/terms/AccessConstraints,,
http://rs.tdwg.org/dwc/terms/version/accuracy-2009-01-21,Accuracy,Abstract term to capture error information about a measurement or fact.,,,,2009-01-21,deprecated,,http://www.w3.org/1999/02/22-rdf-syntax-ns#Property,http://rs.tdwg.org/dwc/terms/accuracy,,
http://rs.tdwg.org/dwc/terms/version/associatedMedia-2009-04-24,Associated Media,"A list (concatenated and separated) of identifiers (publication, global unique identifier, URI) of media associated with the Occurrence.","Recommended best practice is to separate the values with a vertical bar (` | `). Examples: `http://arctos.database.museum/SpecimenImages/UAMObs/Mamm/2/P7291179.JPG`, `http://204.140.246.24/Fish/Collection%20Pictures/10118-00.jpg | http://204.140.246.24/Fish/Collection%20Pictures/10118-00a.jpg`. For discussion see http://terms.tdwg.org/wiki/dwc:associatedMedia.",,http://rs.tdwg.org/dwc/terms/Occurrence,2009-04-24,superseded,http://rs.tdwg.org/dwc/dwcore/version/ImageURL-2007-04-17,http://www.w3.org/1999/02/22-rdf-syntax-ns#Property,http://rs.tdwg.org/dwc/terms/associatedMedia,DataSets/DataSet/Units/Unit/MultimediaObjects,simple
http://rs.tdwg.org/dwc/terms/version/associatedMedia-2014-10-23,Associated Media,"A list (concatenated and separated) of identifiers (publication, global unique identifier, URI) of media associated with the Occurrence.","Recommended best practice is to separate the values with a vertical bar (` | `). Examples: `http://arctos.database.museum/SpecimenImages/UAMObs/Mamm/2/P7291179.JPG`, `http://204.140.246.24/Fish/Collection%20Pictures/10118-00.jpg | http://204.140.246.24/Fish/Collection%20Pictures/10118-00a.jpg`. For discussion see http://terms.tdwg.org/wiki/dwc:associatedMedia.",,http://rs.tdwg.org/dwc/terms/Occurrence,2014-10-23,superseded,http://rs.tdwg.org/dwc/terms/version/associatedMedia-2009-04-24,http://www.w3.org/1999/02/22-rdf-syntax-ns#Property,http://rs.tdwg.org/dwc/terms/associatedMedia,DataSets/DataSet/Units/Unit/MultimediaObjects,simple
http://rs.tdwg.org/dwc/terms/version/associatedOccurrences-2009-04-24,Associated Occurrences,A list (concatenated and separated) of identifiers of other Occurrence records and their associations to this Occurrence.,Recommended best practice is to separate the values with a vertical bar (` | `). For discussion see http://terms.tdwg.org/wiki/dwc:associatedOccurrences.,,http://rs.tdwg.org/dwc/terms/Organism,2009-04-24,superseded,http://rs.tdwg.org/dwc/curatorial/version/RelatedCatalogedItems-2007-04-17,http://www.w3.org/1999/02/22-rdf-syntax-ns#Property,http://rs.tdwg.org/dwc/terms/associatedOccurrences,DataSets/DataSet/Units/Unit/Associations/UnitAssociation/AssociatedUnitSourceInstitutionCode + DataSets/DataSet/Units/Unit/Associations/UnitAssociation/AssociatedUnitSourceName + DataSets/DataSet/Units/Unit/Associations/UnitAssociation/AssociatedUnitID,simple
http://rs.tdwg.org/dwc/terms/version/associatedOccurrences-2014-10-23,Associated Occurrences,A list (concatenated and separated) of identifiers of other Occurrence records and their associations to this Occurrence.,Recommended best practice is to separate the values with a vertical bar (` | `). For discussion see http://terms.tdwg.org/wiki/dwc:associatedOccurrences.,,http://rs.tdwg.org/dwc/terms/Organism,2014-10-23,superseded,http://rs.tdwg.org/dwc/terms/version/associatedOccurrences-2009-04-24,http://www.w3.org/1999/02/22-rdf-syntax-ns#Property,http://rs.tdwg.org/dwc/terms/associatedOccurrences,DataSets/DataSet/Units/Unit/Associations/UnitAssociation/AssociatedUnitSourceInstitutionCode + DataSets/DataSet/Units/Unit/Associations/UnitAssociation/AssociatedUnitSourceName + DataSets/DataSet/Units/Unit/Associations/UnitAssociation/AssociatedUnitID,simple
http://rs.tdwg.org/dwc/terms/version/associatedOrganisms-2014-10-23,Associated Organisms,A list (concatenated and separated) of identifiers of other Organisms and their associations to this Organism.,"Recommended best practice is to separate the values with a vertical bar (` | `). Examples: `sibling of MXA-232`, `mother of MXA-231 | mother of MXA-232`. For discussion see http://terms.tdwg.org/wiki/dwc:associatedOrganisms.",,http://rs.tdwg.org/dwc/terms/Organism,2014-10-23,superseded,,http://www.w3.org/1999/02/22-rdf-syntax-ns#Property,http://rs.tdwg.org/dwc/terms/associatedOrganisms,not in ABCD,simple
http://rs.tdwg.org/dwc/terms/version/associatedReferences-2009-04-24,Associated References,"A list (concatenated and separated) of identifiers (publication, bibliographic reference, global unique identifier, URI) of literature associated with the Occurrence.","Recommended best practice is to separate the values with a vertical bar (` | `). Examples: `http://www.sciencemag.org/cgi/content/abstract/322/5899/261`, `Christopher J. Conroy, Jennifer L. Neuwald. 2008. Phylogeographic study of the California vole, Microtus californicus Journal of Mammalogy, 89(3):755-767.`, `Steven R. Hoofer and Ronald A. Van Den Bussche. 2001. Phylogenetic Relationships of Plecotine Bats and Allies Based on Mitochondrial Ribosomal Sequences. Journal of Mammalogy 82(1):131-137. | Walker, Faith M., Jeffrey T. Foster, Kevin P. Drees, Carol L. Chambers. 2014. Spotted bat (Euderma maculatum) microsatellite discovery using illumina sequencing. Conservation Genetics Resources.`. For discussion see http://terms.tdwg.org/wiki/dwc:associatedReferences.",,http://rs.tdwg.org/dwc/terms/Occurrence,2009-04-24,superseded,,http://www.w3.org/1999/02/22-rdf-syntax-ns#Property,http://rs.tdwg.org/dwc/terms/associatedReferences,DataSets/DataSet/Units/Unit/UnitReferences,simple
http://rs.tdwg.org/dwc/terms/version/associatedReferences-2014-10-23,Associated References,"A list (concatenated and separated) of identifiers (publication, bibliographic reference, global unique identifier, URI) of literature associated with the Occurrence.","Recommended best practice is to separate the values with a vertical bar (` | `). Examples: `http://www.sciencemag.org/cgi/content/abstract/322/5899/261`, `Christopher J. Conroy, Jennifer L. Neuwald. 2008. Phylogeographic study of the California vole, Microtus californicus Journal of Mammalogy, 89(3):755-767.`, `Steven R. Hoofer and Ronald A. Van Den Bussche. 2001. Phylogenetic Relationships of Plecotine Bats and Allies Based on Mitochondrial Ribosomal Sequences. Journal of Mammalogy 82(1):131-137. | Walker, Faith M., Jeffrey T. Foster, Kevin P. Drees, Carol L. Chambers. 2014. Spotted bat (Euderma maculatum) microsatellite discovery using illumina sequencing. Conservation Genetics Resources.`. For discussion see http://terms.tdwg.org/wiki/dwc:associatedReferences.",,http://rs.tdwg.org/dwc/terms/Occurrence,2014-10-23,superseded,http://rs.tdwg.org/dwc/terms/version/associatedReferences-2009-04-24,http://www.w3.org/1999/02/22-rdf-syntax-ns#Property,http://rs.tdwg.org/dwc/terms/associatedReferences,DataSets/DataSet/Units/Unit/UnitReferences,simple
http://rs.tdwg.org/dwc/terms/version/associatedSequences-2009-04-24,Associated Sequences,"A list (concatenated and separated) of identifiers (publication, global unique identifier, URI) of genetic sequence information associated with the Occurrence.","Recommended best practice is to separate the values with a vertical bar (` | `). Examples: `http://www.ncbi.nlm.nih.gov/nuccore/U34853.1`, `http://www.ncbi.nlm.nih.gov/nuccore/GU328060 | http://www.ncbi.nlm.nih.gov/nuccore/AF326093`. For discussion see http://terms.tdwg.org/wiki/dwc:associatedSequences.",,http://rs.tdwg.org/dwc/terms/Occurrence,2009-04-24,superseded,http://rs.tdwg.org/dwc/curatorial/version/GenBankNumber-2007-04-17,http://www.w3.org/1999/02/22-rdf-syntax-ns#Property,http://rs.tdwg.org/dwc/terms/associatedSequences,DataSets/DataSet/Units/Unit/Sequences/Sequence/ID-in-Database + constant,simple
http://rs.tdwg.org/dwc/terms/version/associatedSequences-2014-10-23,Associated Sequences,"A list (concatenated and separated) of identifiers (publication, global unique identifier, URI) of genetic sequence information associated with the Occurrence.","Recommended best practice is to separate the values with a vertical bar (` | `). Examples: `http://www.ncbi.nlm.nih.gov/nuccore/U34853.1`, `http://www.ncbi.nlm.nih.gov/nuccore/GU328060 | http://www.ncbi.nlm.nih.gov/nuccore/AF326093`. For discussion see http://terms.tdwg.org/wiki/dwc:associatedSequences.",,http://rs.tdwg.org/dwc/terms/Occurrence,2014-10-23,superseded,http://rs.tdwg.org/dwc/terms/version/associatedSequences-2009-04-24,http://www.w3.org/1999/02/22-rdf-syntax-ns#Property,http://rs.tdwg.org/dwc/terms/associatedSequences,DataSets/DataSet/Units/Unit/Sequences/Sequence/ID-in-Database + constant,simple
http://rs.tdwg.org/dwc/terms/version/associatedTaxa-2009-04-24,Associated Taxa,A list (concatenated and separated) of identifiers or names of taxa and their associations with the Occurrence.,"Recommended best practice is to separate the values with a vertical bar (` | `), and to separate the relationship from the taxon with a colon (`:`). Examples: `host:Quercus alba`, `parasitoid of:Cyclocephala signaticollis | predator of Apis mellifera`. For discussion see http://terms.tdwg.org/wiki/dwc:associatedTaxa.",,http://rs.tdwg.org/dwc/terms/Occurrence,2009-04-24,superseded,,http://www.w3.org/1999/02/22-rdf-syntax-ns#Property,http://rs.tdwg.org/dwc/terms/associatedTaxa,DataSets/DataSet/Units/Unit/Gathering/Synecology/AssociatedTaxa,simple
http://rs.tdwg.org/dwc/terms/version/associatedTaxa-2014-10-23,Associated Taxa,A list (concatenated and separated) of identifiers or names of taxa and their associations with the Occurrence.,"Recommended best practice is to separate the values with a vertical bar (` | `), and to separate the relationship from the taxon with a colon (`:`). Examples: `host:Quercus alba`, `parasitoid of:Cyclocephala signaticollis | predator of Apis mellifera`. For discussion see http://terms.tdwg.org/wiki/dwc:associatedTaxa.",,http://rs.tdwg.org/dwc/terms/Occurrence,2014-10-23,superseded,http://rs.tdwg.org/dwc/terms/version/associatedTaxa-2009-04-24,http://www.w3.org/1999/02/22-rdf-syntax-ns#Property,http://rs.tdwg.org/dwc/terms/associatedTaxa,DataSets/DataSet/Units/Unit/Gathering/Synecology/AssociatedTaxa,simple
http://rs.tdwg.org/dwc/terms/version/basionym-2009-04-24,Basionym,The basionym (botany) or basonym (bacteriology) of the scientificName.,,,,2009-04-24,deprecated,,http://www.w3.org/1999/02/22-rdf-syntax-ns#Property,http://rs.tdwg.org/dwc/terms/basionym,,
http://rs.tdwg.org/dwc/terms/version/basionymID-2009-04-24,Basionym ID,A unique identifier for the basionym (botany) or basonym (bacteriology) of the scientificName.,,,,2009-04-24,deprecated,,http://www.w3.org/1999/02/22-rdf-syntax-ns#Property,http://rs.tdwg.org/dwc/terms/basionymID,,
http://rs.tdwg.org/dwc/terms/version/basisOfRecord-2009-04-24,Basis of Record,The specific nature of the data record - a subtype of the dcterms:type. Recommended best practice is to use a controlled vocabulary such as the Darwin Core Type Vocabulary (http://rs.tdwg.org/dwc/terms/type-vocabulary/index.htm).,"Recommended best practice is to use a controlled vocabulary such as the list of Darwin Core classes. Examples: `PreservedSpecimen`, `FossilSpecimen`, `LivingSpecimen`, `HumanObservation`, `MachineObservation`. For discussion see http://terms.tdwg.org/wiki/dwc:basisOfRecord.",,http://rs.tdwg.org/dwc/terms/,2009-04-24,superseded,http://rs.tdwg.org/dwc/dwcore/version/BasisOfRecord-2007-04-17,http://www.w3.org/1999/02/22-rdf-syntax-ns#Property,http://rs.tdwg.org/dwc/terms/basisOfRecord,DataSets/DataSet/Units/Unit/RecordBasis,simple
http://rs.tdwg.org/dwc/terms/version/basisOfRecord-2009-09-11,Basis of Record,The specific nature of the data record - a subtype of the dcterms:type. Recommended best practice is to use a controlled vocabulary.,"Recommended best practice is to use a controlled vocabulary such as the list of Darwin Core classes. Examples: `PreservedSpecimen`, `FossilSpecimen`, `LivingSpecimen`, `HumanObservation`, `MachineObservation`. For discussion see http://terms.tdwg.org/wiki/dwc:basisOfRecord.",,http://rs.tdwg.org/dwc/terms/,2009-09-11,superseded,http://rs.tdwg.org/dwc/terms/version/basisOfRecord-2009-04-24,http://www.w3.org/1999/02/22-rdf-syntax-ns#Property,http://rs.tdwg.org/dwc/terms/basisOfRecord,DataSets/DataSet/Units/Unit/RecordBasis,simple
http://rs.tdwg.org/dwc/terms/version/basisOfRecord-2009-12-07,Basis of Record,The specific nature of the data record. Recommended best practice is to use a controlled vocabulary such as the Darwin Core Type Vocabulary (http://rs.tdwg.org/dwc/terms/type-vocabulary/index.htm).,"Recommended best practice is to use a controlled vocabulary such as the list of Darwin Core classes. Examples: `PreservedSpecimen`, `FossilSpecimen`, `LivingSpecimen`, `HumanObservation`, `MachineObservation`. For discussion see http://terms.tdwg.org/wiki/dwc:basisOfRecord.",,http://rs.tdwg.org/dwc/terms/,2009-12-07,superseded,http://rs.tdwg.org/dwc/terms/version/basisOfRecord-2009-09-11,http://www.w3.org/1999/02/22-rdf-syntax-ns#Property,http://rs.tdwg.org/dwc/terms/basisOfRecord,DataSets/DataSet/Units/Unit/RecordBasis,simple
http://rs.tdwg.org/dwc/terms/version/basisOfRecord-2014-10-23,Basis of Record,The specific nature of the data record.,"Recommended best practice is to use a controlled vocabulary such as the list of Darwin Core classes. Examples: `PreservedSpecimen`, `FossilSpecimen`, `LivingSpecimen`, `HumanObservation`, `MachineObservation`. For discussion see http://terms.tdwg.org/wiki/dwc:basisOfRecord.",,http://rs.tdwg.org/dwc/terms/,2014-10-23,superseded,http://rs.tdwg.org/dwc/terms/version/basisOfRecord-2009-12-07,http://www.w3.org/1999/02/22-rdf-syntax-ns#Property,http://rs.tdwg.org/dwc/terms/basisOfRecord,DataSets/DataSet/Units/Unit/RecordBasis,simple
http://rs.tdwg.org/dwc/terms/version/bed-2009-04-24,Bed,The full name of the lithostratigraphic bed from which the cataloged item was collected.,For discussion see http://terms.tdwg.org/wiki/dwc:bed.,,http://rs.tdwg.org/dwc/terms/GeologicalContext,2009-04-24,superseded,http://digir.net/schema/conceptual/darwin/extension/paleontology/1.0/version/Bed-2005-07-03,http://www.w3.org/1999/02/22-rdf-syntax-ns#Property,http://rs.tdwg.org/dwc/terms/bed,not in ABCD,simple
http://rs.tdwg.org/dwc/terms/version/behavior-2009-04-24,Behavior,A description of the behavior shown by the subject at the time the Occurrence was recorded. Recommended best practice is to use a controlled vocabulary.,"Recommended best practice is to use a controlled vocabulary. Examples: `roosting`, `foraging`, `running`. For discussion see http://terms.tdwg.org/wiki/dwc:behavior.",,http://rs.tdwg.org/dwc/terms/Occurrence,2009-04-24,superseded,,http://www.w3.org/1999/02/22-rdf-syntax-ns#Property,http://rs.tdwg.org/dwc/terms/behavior,not in ABCD,simple
http://rs.tdwg.org/dwc/terms/version/binomial-2008-11-19,Binomial,The combination of genus and first (species) epithet of the scientificName.,,,,2008-11-19,deprecated,,http://www.w3.org/1999/02/22-rdf-syntax-ns#Property,http://rs.tdwg.org/dwc/terms/binomial,,
http://rs.tdwg.org/dwc/terms/version/catalogNumber-2009-04-24,Catalog Number,An identifier (preferably unique) for the record within the data set or collection.,"Examples: `2008.1334`, `145732a`, `145732`. For discussion see http://terms.tdwg.org/wiki/dwc:catalogNumber.",,http://rs.tdwg.org/dwc/terms/Occurrence,2009-04-24,superseded,http://rs.tdwg.org/dwc/dwcore/version/CatalogNumber-2007-04-17,http://www.w3.org/1999/02/22-rdf-syntax-ns#Property,http://rs.tdwg.org/dwc/terms/catalogNumber,DataSets/DataSet/Units/Unit/UnitID,simple
http://rs.tdwg.org/dwc/terms/version/CatalogNumberNumeric-2008-11-19,Catalog Number Numeric,"The numeric value of the catalogNumber, used to facilitate numerical sorting and searching by ranges.",,,,2008-11-19,deprecated,http://digir.net/schema/conceptual/darwin/2003/1.0/version/CatalogNumberNumeric-2003-06-17,http://www.w3.org/1999/02/22-rdf-syntax-ns#Property,http://rs.tdwg.org/dwc/terms/CatalogNumberNumeric,,
http://rs.tdwg.org/dwc/terms/version/class-2009-04-24,Class,The name of the class in which the scientificName is classified.,"Examples: `Mammalia`, `Hepaticopsida`. For discussion see http://terms.tdwg.org/wiki/dwc:class.",,http://rs.tdwg.org/dwc/terms/Taxon,2009-04-24,superseded,http://rs.tdwg.org/dwc/dwcore/version/Class-2007-04-17,http://www.w3.org/1999/02/22-rdf-syntax-ns#Property,http://rs.tdwg.org/dwc/terms/class,DataSets/DataSet/Units/Unit/Identifications/Identification/TaxonIdentified/HigherTaxa/HigherTaxon/HigherTaxonName with HigherTaxa/HigherTaxon/HigherTaxonRank = classis,simple
http://rs.tdwg.org/dwc/terms/version/class-2009-08-24,Class,The full scientific name of the class in which the taxon is classified.,"Examples: `Mammalia`, `Hepaticopsida`. For discussion see http://terms.tdwg.org/wiki/dwc:class.",,http://rs.tdwg.org/dwc/terms/Taxon,2009-08-24,superseded,http://rs.tdwg.org/dwc/terms/version/class-2009-04-24,http://www.w3.org/1999/02/22-rdf-syntax-ns#Property,http://rs.tdwg.org/dwc/terms/class,DataSets/DataSet/Units/Unit/Identifications/Identification/TaxonIdentified/HigherTaxa/HigherTaxon/HigherTaxonName with HigherTaxa/HigherTaxon/HigherTaxonRank = classis,simple
http://rs.tdwg.org/dwc/terms/version/collectionCode-2009-04-24,Collection Code,The name (or acronym) identifying the collection or data set from which the record was derived.,"Examples: `Mammals`, `Hildebrandt`, `eBird`. For discussion see http://terms.tdwg.org/wiki/dwc:collectionCode.",,http://rs.tdwg.org/dwc/terms/,2009-04-24,superseded,http://rs.tdwg.org/dwc/dwcore/version/CollectionCode-2007-04-17,http://www.w3.org/1999/02/22-rdf-syntax-ns#Property,http://rs.tdwg.org/dwc/terms/collectionCode,DataSets/DataSet/Units/Unit/SourceID,simple
http://rs.tdwg.org/dwc/terms/version/collectionCode-2009-08-24,Collection Code,"The name, acronym, coden, or initialism identifying the collection or data set from which the record was derived.","Examples: `Mammals`, `Hildebrandt`, `eBird`. For discussion see http://terms.tdwg.org/wiki/dwc:collectionCode.",,http://rs.tdwg.org/dwc/terms/,2009-08-24,superseded,http://rs.tdwg.org/dwc/terms/version/collectionCode-2009-04-24,http://www.w3.org/1999/02/22-rdf-syntax-ns#Property,http://rs.tdwg.org/dwc/terms/collectionCode,DataSets/DataSet/Units/Unit/SourceID,simple
