label,issued,status,term_iri,iri,replaces,rdf_type,definition
Subspecies,2003-06-13,superseded,http://digir.net/schema/conceptual/darwin/2003/1.0/Subspecies,http://digir.net/schema/conceptual/darwin/2003/1.0/version/Subspecies-2003-06-13,,http://www.w3.org/1999/02/22-rdf-syntax-ns#Property,The sub-specific epithet of the organism
Subspecies,2003-06-17,deprecated,http://digir.net/schema/conceptual/darwin/2003/1.0/Subspecies,http://digir.net/schema/conceptual/darwin/2003/1.0/version/Subspecies-2003-06-17,http://digir.net/schema/conceptual/darwin/2003/1.0/version/Subspecies-2003-06-13,http://www.w3.org/1999/02/22-rdf-syntax-ns#Property,The phylogenetic subspecific epithet of the cataloged item.
TimeCollected,2003-06-17,deprecated,http://digir.net/schema/conceptual/darwin/2003/1.0/TimeCollected,http://digir.net/schema/conceptual/darwin/2003/1.0/version/TimeCollected-2003-06-17,http://digir.net/schema/conceptual/darwin/2003/1.0/version/TimeOfDay-2003-06-13,http://www.w3.org/1999/02/22-rdf-syntax-ns#Property,"The time of day the cataloged item was collected, expressed as decimal hours from midnight, local time (e.g., 12.0 = noon, 13.5 = 1:30pm)."
TimeOfDay,2003-06-13,deprecated,http://digir.net/schema/conceptual/darwin/2003/1.0/TimeOfDay,http://digir.net/schema/conceptual/darwin/2003/1.0/version/TimeOfDay-2003-06-13,,http://www.w3.org/1999/02/22-rdf-syntax-ns#Property,"The time of day a specimen was collected expressed as decimal hours from midnight local time (e.g. 12.0 = mid day, 13.5 = 1:30pm)"
Tissues,2003-06-17,deprecated,http://digir.net/schema/conceptual/darwin/2003/1.0/Tissues,http://digir.net/schema/conceptual/darwin/2003/1.0/version/Tissues-2003-06-17,,http://www.w3.org/1999/02/22-rdf-syntax-ns#Property,"A concatenated list of tissues and preservation methods (whole (frozen), liver (EDTA), etc.) for the cataloged item."
TypeStatus,2003-06-13,superseded,http://digir.net/schema/conceptual/darwin/2003/1.0/TypeStatus,http://digir.net/schema/conceptual/darwin/2003/1.0/version/TypeStatus-2003-06-13,,http://www.w3.org/1999/02/22-rdf-syntax-ns#Property,"Indicates the kind of nomenclatural type that a specimen represents. (This is incomplete because type status actually describes the relationship between a name and a specimen [or ternary relatiohnship between a specimen, name, and publication].) In particular, the type status may not apply to the name listed in the scientific name, i.e., current identification. In rare cases, a single specimen may be the type of more than one name."
TypeStatus,2003-06-17,deprecated,http://digir.net/schema/conceptual/darwin/2003/1.0/TypeStatus,http://digir.net/schema/conceptual/darwin/2003/1.0/version/TypeStatus-2003-06-17,http://digir.net/schema/conceptual/darwin/2003/1.0/version/TypeStatus-2003-06-13,http://www.w3.org/1999/02/22-rdf-syntax-ns#Property,"A list of one or more nomenclatural types that the cataloged item represents (e.g., ""holotype of Ctenomys sociabilis. Pearson O. P., and M. I. Christie. 1985. Historia Natural, 5(37):388."")."
VerbatimCollectingDate,2003-06-17,deprecated,http://digir.net/schema/conceptual/darwin/2003/1.0/VerbatimCollectingDate,http://digir.net/schema/conceptual/darwin/2003/1.0/version/VerbatimCollectingDate-2003-06-17,,http://www.w3.org/1999/02/22-rdf-syntax-ns#Property,The verbatim original representation of the date information for the collecting event.
VerbatimDepth,2003-06-17,deprecated,http://digir.net/schema/conceptual/darwin/2003/1.0/VerbatimDepth,http://digir.net/schema/conceptual/darwin/2003/1.0/version/VerbatimDepth-2003-06-17,,http://www.w3.org/1999/02/22-rdf-syntax-ns#Property,A text representation of the Depth in its original format in the source database.
VerbatimElevation,2003-06-17,deprecated,http://digir.net/schema/conceptual/darwin/2003/1.0/VerbatimElevation,http://digir.net/schema/conceptual/darwin/2003/1.0/version/VerbatimElevation-2003-06-17,,http://www.w3.org/1999/02/22-rdf-syntax-ns#Property,A text representation of the Elevation in its original format in the source database.
VerbatimLatitude,2003-06-17,deprecated,http://digir.net/schema/conceptual/darwin/2003/1.0/VerbatimLatitude,http://digir.net/schema/conceptual/darwin/2003/1.0/version/VerbatimLatitude-2003-06-17,,http://www.w3.org/1999/02/22-rdf-syntax-ns#Property,A text representation of the Latitude data in its original format in the source database.
VerbatimLongitude,2003-06-17,deprecated,http://digir.net/schema/conceptual/darwin/2003/1.0/VerbatimLongitude,http://digir.net/schema/conceptual/darwin/2003/1.0/version/VerbatimLongitude-2003-06-17,,http://www.w3.org/1999/02/22-rdf-syntax-ns#Property,A text representation of the Longitude data in its original format in the source database.
YearCollected,2003-06-13,superseded,http://digir.net/schema/conceptual/darwin/2003/1.0/YearCollected,http://digir.net/schema/conceptual/darwin/2003/1.0/version/YearCollected-2003-06-13,,http://www.w3.org/1999/02/22-rdf-syntax-ns#Property,"The year (expressed as an integer) in which the specimen was collected. The full year should be expressed (e.g. 1972 must be expressed as ""1972"" not ""72""). Must always be a four digit integer [-9999..9999]"
YearCollected,2003-06-17,deprecated,http://digir.net/schema/conceptual/darwin/2003/1.0/YearCollected,http://digir.net/schema/conceptual/darwin/2003/1.0/version/YearCollected-2003-06-17,http://digir.net/schema/conceptual/darwin/2003/1.0/version/YearCollected-2003-06-13,http://www.w3.org/1999/02/22-rdf-syntax-ns#Property,The four digit year in the Common Era calendar in which the cataloged item was collected.
YearIdentified,2003-06-13,superseded,http://digir.net/schema/conceptual/darwin/2003/1.0/YearIdentified,http://digir.net/schema/conceptual/darwin/2003/1.0/version/YearIdentified-2003-06-13,,http://www.w3.org/1999/02/22-rdf-syntax-ns#Property,"The year portion of the date when the Collection Item was identified; as four digits [-9999..9999], e.g., 1906, 2002."
YearIdentified,2003-06-17,deprecated,http://digir.net/schema/conceptual/darwin/2003/1.0/YearIdentified,http://digir.net/schema/conceptual/darwin/2003/1.0/version/YearIdentified-2003-06-17,http://digir.net/schema/conceptual/darwin/2003/1.0/version/YearIdentified-2003-06-13,http://www.w3.org/1999/02/22-rdf-syntax-ns#Property,The four digit year in the Common Era calendar in which the cataloged item was identified as having the ScientificName.
Bed,2005-07-03,deprecated,http://digir.net/schema/conceptual/darwin/extension/paleontology/1.0/Bed,http://digir.net/schema/conceptual/darwin/extension/paleontology/1.0/version/Bed-2005-07-03,,http://www.w3.org/1999/02/22-rdf-syntax-ns#Property,The full name of the lithostratigraphic bed from which the cataloged item was collected.
EarliestAgeOrLowestStage,2005-07-03,deprecated,http://digir.net/schema/conceptual/darwin/extension/paleontology/1.0/EarliestAgeOrLowestStage,http://digir.net/schema/conceptual/darwin/extension/paleontology/1.0/version/EarliestAgeOrLowestStage-2005-07-03,,http://www.w3.org/1999/02/22-rdf-syntax-ns#Property,The full name of the earliest possible geochronologic age or lowest chronostratigraphic stage attributable to the stratigraphic horizon from which the cataloged item was collected.
EarliestEonOrLowestEonothem,2005-07-03,deprecated,http://digir.net/schema/conceptual/darwin/extension/paleontology/1.0/EarliestEonOrLowestEonothem,http://digir.net/schema/conceptual/darwin/extension/paleontology/1.0/version/EarliestEonOrLowestEonothem-2005-07-03,,http://www.w3.org/1999/02/22-rdf-syntax-ns#Property,"The full name of the earliest possible geochronologic eon or lowest chrono-stratigraphic eonothem or the informal name (""Precambrian"") attributable to the stratigraphic horizon from which the cataloged item was collected."
EarliestEpochOrLowestSeries,2005-07-03,deprecated,http://digir.net/schema/conceptual/darwin/extension/paleontology/1.0/EarliestEpochOrLowestSeries,http://digir.net/schema/conceptual/darwin/extension/paleontology/1.0/version/EarliestEpochOrLowestSeries-2005-07-03,,http://www.w3.org/1999/02/22-rdf-syntax-ns#Property,The full name of the earliest possible geochronologic epoch or lowest chronostratigraphic series attributable to the stratigraphic horizon from which the cataloged item was collected.
EarliestEraOrLowestErathem,2005-07-03,deprecated,http://digir.net/schema/conceptual/darwin/extension/paleontology/1.0/EarliestEraOrLowestErathem,http://digir.net/schema/conceptual/darwin/extension/paleontology/1.0/version/EarliestEraOrLowestErathem-2005-07-03,,http://www.w3.org/1999/02/22-rdf-syntax-ns#Property,The full name of the earliest possible geochronologic era or lowest chronostratigraphic erathem attributable to the stratigraphic horizon from which the cataloged item was collected.
EarliestPeriodOrLowestSystem,2005-07-03,deprecated,http://digir.net/schema/conceptual/darwin/extension/paleontology/1.0/EarliestPeriodOrLowestSystem,http://digir.net/schema/conceptual/darwin/extension/paleontology/1.0/version/EarliestPeriodOrLowestSystem-2005-07-03,,http://www.w3.org/1999/02/22-rdf-syntax-ns#Property,The full name of the earliest possible geochronologic period or lowest chronostratigraphic system attributable to the stratigraphic horizon from which the cataloged item was collected.
Formation,2005-07-03,deprecated,http://digir.net/schema/conceptual/darwin/extension/paleontology/1.0/Formation,http://digir.net/schema/conceptual/darwin/extension/paleontology/1.0/version/Formation-2005-07-03,,http://www.w3.org/1999/02/22-rdf-syntax-ns#Property,The full name of the lithostratigraphic formation from which the cataloged item was collected.
Group,2005-07-03,deprecated,http://digir.net/schema/conceptual/darwin/extension/paleontology/1.0/Group,http://digir.net/schema/conceptual/darwin/extension/paleontology/1.0/version/Group-2005-07-03,,http://www.w3.org/1999/02/22-rdf-syntax-ns#Property,The full name of the lithostratigraphic group from which the cataloged item was collected.
HighestBiostratigraphicZone,2005-07-03,deprecated,http://digir.net/schema/conceptual/darwin/extension/paleontology/1.0/HighestBiostratigraphicZone,http://digir.net/schema/conceptual/darwin/extension/paleontology/1.0/version/HighestBiostratigraphicZone-2005-07-03,,http://www.w3.org/1999/02/22-rdf-syntax-ns#Property,The full name of the highest possible geological biostratigraphic zone of the stratigraphic horizon from which the cataloged item was collected.
LatestAgeOrHighestStage,2005-07-03,deprecated,http://digir.net/schema/conceptual/darwin/extension/paleontology/1.0/LatestAgeOrHighestStage,http://digir.net/schema/conceptual/darwin/extension/paleontology/1.0/version/LatestAgeOrHighestStage-2005-07-03,,http://www.w3.org/1999/02/22-rdf-syntax-ns#Property,The full name of the latest possible geochronologic age or highest chronostratigraphic stage attributable to the stratigraphic horizon from which the cataloged item was collected.
LatestEonOrHighestEonothem,2005-07-03,deprecated,http://digir.net/schema/conceptual/darwin/extension/paleontology/1.0/LatestEonOrHighestEonothem,http://digir.net/schema/conceptual/darwin/extension/paleontology/1.0/version/LatestEonOrHighestEonothem-2005-07-03,,http://www.w3.org/1999/02/22-rdf-syntax-ns#Property,"The full name of the latest possible geochronologic eon or highest chrono-stratigraphic eonothem or the informal name (""Precambrian"") attributable to the stratigraphic horizon from which the cataloged item was collected."
LatestEpochOrHighestSeries,2005-07-03,deprecated,http://digir.net/schema/conceptual/darwin/extension/paleontology/1.0/LatestEpochOrHighestSeries,http://digir.net/schema/conceptual/darwin/extension/paleontology/1.0/version/LatestEpochOrHighestSeries-2005-07-03,,http://www.w3.org/1999/02/22-rdf-syntax-ns#Property,The full name of the latest possible geochronologic epoch or highest chronostratigraphic series attributable to the stratigraphic horizon from which the cataloged item was collected.
LatestEraOrHighestErathem,2005-07-03,deprecated,http://digir.net/schema/conceptual/darwin/extension/paleontology/1.0/LatestEraOrHighestErathem,http://digir.net/schema/conceptual/darwin/extension/paleontology/1.0/version/LatestEraOrHighestErathem-2005-07-03,,http://www.w3.org/1999/02/22-rdf-syntax-ns#Property,The full name of the latest possible geochronologic era or highest chronostratigraphic erathem attributable to the stratigraphic horizon from which the cataloged item was collected.
LatestPeriodOrHighestSystem,2005-07-03,deprecated,http://digir.net/schema/conceptual/darwin/extension/paleontology/1.0/LatestPeriodOrHighestSystem,http://digir.net/schema/conceptual/darwin/extension/paleontology/1.0/version/LatestPeriodOrHighestSystem-2005-07-03,,http://www.w3.org/1999/02/22-rdf-syntax-ns#Property,The full name of the latest possible geochronologic period or highest chronostratigraphic system attributable to the stratigraphic horizon from which the cataloged item was collected.
LithostratigraphicTerms,2005-07-03,deprecated,http://digir.net/schema/conceptual/darwin/extension/paleontology/1.0/LithostratigraphicTerms,http://digir.net/schema/conceptual/darwin/extension/paleontology/1.0/version/LithostratigraphicTerms-2005-07-03,,http://www.w3.org/1999/02/22-rdf-syntax-ns#Property,The combination of all litho-stratigraphic names for the rock from which the cataloged item was collected.
LowestBiostratigraphicZone,2005-07-03,deprecated,http://digir.net/schema/conceptual/darwin/extension/paleontology/1.0/LowestBiostratigraphicZone,http://digir.net/schema/conceptual/darwin/extension/paleontology/1.0/version/LowestBiostratigraphicZone-2005-07-03,,http://www.w3.org/1999/02/22-rdf-syntax-ns#Property,The full name of the lowest possible geological biostratigraphic zone of the stratigraphic horizon from which the cataloged item was collected.
Member,2005-07-03,deprecated,http://digir.net/schema/conceptual/darwin/extension/paleontology/1.0/Member,http://digir.net/schema/conceptual/darwin/extension/paleontology/1.0/version/Member-2005-07-03,,http://www.w3.org/1999/02/22-rdf-syntax-ns#Property,The full name of the lithostratigraphic member from which the cataloged item was collected.
source_mat_id,2011-01-26,deprecated,http://gensc.org/ns/mixs/source_mat_id,http://gensc.org/ns/mixs/version/source_mat_id-2011-01-26,,http://www.w3.org/1999/02/22-rdf-syntax-ns#Property,"A unique identifier assigned to a material sample (as defined by http://rs.tdwg.org/dwc/terms/MaterialSampleID, and as opposed to a particular digital record of a material sample) used for extracting nucleic acids, and subsequent sequencing. The identifier can refer either to the original material collected or to any derived sub-samples. The INSDC qualifiers /specimen_voucher, /bio_material, or /culture_collection provide additional context and suggested syntax for this identifier for data submitted to INSDC databases."
Attributes,2007-04-17,deprecated,http://rs.tdwg.org/dwc/dwcore/Attributes,http://rs.tdwg.org/dwc/dwcore/version/Attributes-2007-04-17,,http://www.w3.org/1999/02/22-rdf-syntax-ns#Property,"List of additional measurements or characteristics (concatenated and separated) for which there is no existing semantic element, but which the data provider nevertheless feels the desire to share. Examples: ""Tragus length: 14mm; Weight: 120g"", ""Height: 1-1.5 meters tall; flowers yellow; uncommon""."
AuthorYearOfScientificName,2007-04-17,deprecated,http://rs.tdwg.org/dwc/dwcore/AuthorYearOfScientificName,http://rs.tdwg.org/dwc/dwcore/version/AuthorYearOfScientificName-2007-04-17,http://digir.net/schema/conceptual/darwin/2003/1.0/version/ScientificNameAuthor-2003-06-17,http://www.w3.org/1999/02/22-rdf-syntax-ns#Property,"The author of the ScientificName and the year of publication, if known. More than one author can be listed in a concatenated string. Should be formatted with parentheses and year according to the conventions of the applicable NomenclaturalCode."
BasisOfRecord,2007-04-17,deprecated,http://rs.tdwg.org/dwc/dwcore/BasisOfRecord,http://rs.tdwg.org/dwc/dwcore/version/BasisOfRecord-2007-04-17,http://digir.net/schema/conceptual/darwin/2003/1.0/version/BasisOfRecord-2003-06-17,http://www.w3.org/1999/02/22-rdf-syntax-ns#Property,"A descriptive term indicating whether the record represents an object or observation. Examples: PreservedSpecimen- A physical object representing one or more organisms, part of organism, or artifact of an organism. synonyms: voucher, collection, lot. FossilSpecimen- A physical object representing one or more fossil organisms, part of fossil organism, or artifact of a fossil organism. LivingSpecimen- An organism removed from its natural occurrence and now living in captivity or cultivation. HumanObservation- A report by a known observer that an organism was present at the place and time. MachineObservation- A report by a monitoring device that an organism was present at the place and time. StillImage- An photograph, drawing, painting. MovingImage- A sequence of still images taken at regular intervals and intended to be played back as a moving image; may include sound. SoundRecording- An audio recording. OtherSpecimen- Any type of specimen not covered by any of the categories above."
CatalogNumber,2007-04-17,deprecated,http://rs.tdwg.org/dwc/dwcore/CatalogNumber,http://rs.tdwg.org/dwc/dwcore/version/CatalogNumber-2007-04-17,http://digir.net/schema/conceptual/darwin/2003/1.0/version/CatalogNumberText-2003-06-17,http://www.w3.org/1999/02/22-rdf-syntax-ns#Property,"The alphanumeric value identifying a record within the collection. It is highly recommended that each record be uniquely identified within a collection by this value. It is also recommended that each record be uniquely identified in a global context by the combination of InstitutionCode, CollectionCode and CatalogNumber."
Class,2007-04-17,deprecated,http://rs.tdwg.org/dwc/dwcore/Class,http://rs.tdwg.org/dwc/dwcore/version/Class-2007-04-17,http://digir.net/schema/conceptual/darwin/2003/1.0/version/Class-2003-06-17,http://www.w3.org/1999/02/22-rdf-syntax-ns#Property,The name of the class in which the organism is classified.
CollectingMethod,2007-04-17,deprecated,http://rs.tdwg.org/dwc/dwcore/CollectingMethod,http://rs.tdwg.org/dwc/dwcore/version/CollectingMethod-2007-04-17,,http://www.w3.org/1999/02/22-rdf-syntax-ns#Property,"The name of, reference to, or brief description of the method or protocol under which the collecting event occurred. Examples: ""UV light trap"", ""mist net"", ""bottom trawl""."
CollectionCode,2007-04-17,deprecated,http://rs.tdwg.org/dwc/dwcore/CollectionCode,http://rs.tdwg.org/dwc/dwcore/version/CollectionCode-2007-04-17,http://digir.net/schema/conceptual/darwin/2003/1.0/version/CollectionCode-2003-06-17,http://www.w3.org/1999/02/22-rdf-syntax-ns#Property,The code (or acronym) identifying the collection within the institution in which the organism record is cataloged.
Collector,2007-04-17,deprecated,http://rs.tdwg.org/dwc/dwcore/Collector,http://rs.tdwg.org/dwc/dwcore/version/Collector-2007-04-17,http://digir.net/schema/conceptual/darwin/2003/1.0/version/Collector-2003-06-17,http://www.w3.org/1999/02/22-rdf-syntax-ns#Property,"The name(s) (concatenated and separated) of collectors or observers. ""LIKE"" or ""contains"" substring query operations are meant to be used with this element to find matching collector names. The primary collector or observer, especially one whose CollectorNumber is also provided, should be listed first. Example: ""Oliver P. Pearson, Anita K. Pearson"" where the value in CollectorNumber ""OPP 7101"" corresponds to the number for the specimen in the field catalog (collector number) of Oliver P. Pearson."
Continent,2007-04-17,deprecated,http://rs.tdwg.org/dwc/dwcore/Continent,http://rs.tdwg.org/dwc/dwcore/version/Continent-2007-04-17,http://digir.net/schema/conceptual/darwin/2003/1.0/version/ContinentOcean-2003-06-17,http://www.w3.org/1999/02/22-rdf-syntax-ns#Property,"The full, unabbreviated name of the continent on which the organism was collected or observed."
Country,2007-04-17,deprecated,http://rs.tdwg.org/dwc/dwcore/Country,http://rs.tdwg.org/dwc/dwcore/version/Country-2007-04-17,http://digir.net/schema/conceptual/darwin/2003/1.0/version/Country-2003-06-17,http://www.w3.org/1999/02/22-rdf-syntax-ns#Property,"The full, unabbreviated name of the country or major political unit in which the organism was collected or observed."
County,2007-04-17,deprecated,http://rs.tdwg.org/dwc/dwcore/County,http://rs.tdwg.org/dwc/dwcore/version/County-2007-04-17,http://digir.net/schema/conceptual/darwin/2003/1.0/version/County-2003-06-17,http://www.w3.org/1999/02/22-rdf-syntax-ns#Property,"The full, unabbreviated name of the county, shire, or municipality (i.e., the next smaller political region than StateProvince) in which the organism was collected or observed."
DateLastModified,2007-04-17,deprecated,http://rs.tdwg.org/dwc/dwcore/DateLastModified,http://rs.tdwg.org/dwc/dwcore/version/DateLastModified-2007-04-17,http://digir.net/schema/conceptual/darwin/2003/1.0/version/DateLastModified-2003-06-17,http://www.w3.org/1999/02/22-rdf-syntax-ns#Property,"The last date-time of publication when any of the data for the record were modified from the previous publication of that record. When publishing a record for the first time, use the publication date-time. Returns values as ISO 8601 date and time. (cf. http://www.w3.org/TR/xmlschema-2/#isoformats and http://www.iso.org/iso/en/prods-services/popstds/dateandtime.html Example: November 5, 1994, 8:15:30 am, US Eastern Standard Time"" would be ""1994-11-05T13:15:30Z"""
DayOfYear,2007-04-17,deprecated,http://rs.tdwg.org/dwc/dwcore/DayOfYear,http://rs.tdwg.org/dwc/dwcore/version/DayOfYear-2007-04-17,http://digir.net/schema/conceptual/darwin/2003/1.0/version/JulianDay-2003-06-17,http://www.w3.org/1999/02/22-rdf-syntax-ns#Property,"The ordinal day of the year on which the object or observation was collected (1 for January 1, 365 for December 31, except in a leap year, in which case it is 366). If the EarliestDateCollected and LatestDateCollected do not occur on the same day, do not populate DayOfYear."
EarliestDateCollected,2007-04-17,deprecated,http://rs.tdwg.org/dwc/dwcore/EarliestDateCollected,http://rs.tdwg.org/dwc/dwcore/version/EarliestDateCollected-2007-04-17,http://digir.net/schema/conceptual/darwin/2003/1.0/version/DayCollected-2003-06-17|http://digir.net/schema/conceptual/darwin/2003/1.0/version/MonthCollected-2003-06-17|http://digir.net/schema/conceptual/darwin/2003/1.0/version/YearCollected-2003-06-17,http://www.w3.org/1999/02/22-rdf-syntax-ns#Property,"The earliest date-time (Common Era calendar) in a date-time period during which an organism or group of organisms was collected or observed. If the event is recorded as occurring at a single date-time, populate both EarliestDateCollected and LatestDateCollected with the same value."
Family,2007-04-17,deprecated,http://rs.tdwg.org/dwc/dwcore/Family,http://rs.tdwg.org/dwc/dwcore/version/Family-2007-04-17,http://digir.net/schema/conceptual/darwin/2003/1.0/version/Family-2003-06-17,http://www.w3.org/1999/02/22-rdf-syntax-ns#Property,The name of the family in which the organism is classified.
Genus,2007-04-17,deprecated,http://rs.tdwg.org/dwc/dwcore/Genus,http://rs.tdwg.org/dwc/dwcore/version/Genus-2007-04-17,http://digir.net/schema/conceptual/darwin/2003/1.0/version/Genus-2003-06-17,http://www.w3.org/1999/02/22-rdf-syntax-ns#Property,The name of the genus in which the organism is classified.
GlobalUniqueIdentifier,2007-04-17,deprecated,http://rs.tdwg.org/dwc/dwcore/GlobalUniqueIdentifier,http://rs.tdwg.org/dwc/dwcore/version/GlobalUniqueIdentifier-2007-04-17,,http://www.w3.org/1999/02/22-rdf-syntax-ns#Property,"A Uniform Resource Name (URN) as a unique identifier for the specimen or observation record. In the absence of a persistent global unique identifier, construct one in the form: ""[InstitutionCode]:[CollectionCode]: [CatalogNumber]"" Examples: 1) urn:lsid:nhm.ku.edu:Herps:32 2) ""FMNH:Mammal:145732"""
HigherGeography,2007-04-17,deprecated,http://rs.tdwg.org/dwc/dwcore/HigherGeography,http://rs.tdwg.org/dwc/dwcore/version/HigherGeography-2007-04-17,http://digir.net/schema/conceptual/darwin/2003/1.0/version/HigherGeography-2003-06-17,http://www.w3.org/1999/02/22-rdf-syntax-ns#Property,"The names (concatenated and separated) of geographic elements less specific than the information in the Locality element. ""LIKE"" or ""contains"" substring query operations are meant to be used with this element to find matching geographic names. This can be useful if it is unclear in which element a name might be found, and in cases where there is no other appropriate geographic element. Example: ""South America, Argentina, Patagonia, Parque Nacional Nahuel Huapi, Neuqun, Los Lagos"" with accompanying values ""South America"" in Continent, ""Argentina"" in Country, ""Neuqun"" in StateProvince, and Los Lagos in County."
HigherTaxon,2007-04-17,deprecated,http://rs.tdwg.org/dwc/dwcore/HigherTaxon,http://rs.tdwg.org/dwc/dwcore/version/HigherTaxon-2007-04-17,http://digir.net/schema/conceptual/darwin/2003/1.0/version/HigherTaxon-2003-06-17,http://www.w3.org/1999/02/22-rdf-syntax-ns#Property,"The names of taxonomic ranks less specific than SpecificEpithet concatenated and separated. ""LIKE"" or ""contains"" substring query operations are meant to be used with this element to find matching higher taxon names. This element may contain the list of scientific names of all of the supra-specific taxa in the classification used to identify (determine) the specimen or observation. Example: ""Animalia, Chordata, Vertebrata, Mammalia, Theria, Eutheria, Rodentia, Hystricognatha, Hystricognathi, Ctenomyidae, Ctenomyini, Ctenomys""."
