label,issued,status,term_iri,iri,replaces,rdf_type,definition
Identification,2014-10-23,recommended,http://rs.tdwg.org/dwc/terms/Identification,http://rs.tdwg.org/dwc/terms/version/Identification-2014-10-23,http://rs.tdwg.org/dwc/terms/version/Identification-2008-11-19,http://www.w3.org/2000/01/rdf-schema#Class,"A taxonomic determination (e.g., the assignment to a taxon)."
Identification Attributes,2009-04-24,deprecated,http://rs.tdwg.org/dwc/terms/identificationAttributes,http://rs.tdwg.org/dwc/terms/version/identificationAttributes-2009-04-24,,http://www.w3.org/1999/02/22-rdf-syntax-ns#Property,"A list (concatenated and separated) of additional measurements, facts, characteristics, or assertions about the Identification."
Identification ID,2009-04-24,recommended,http://rs.tdwg.org/dwc/terms/identificationID,http://rs.tdwg.org/dwc/terms/version/identificationID-2009-04-24,,http://www.w3.org/1999/02/22-rdf-syntax-ns#Property,An identifier for the Identification (the body of information associated with the assignment of a scientific name). May be a global unique identifier or an identifier specific to the data set.
Identification Qualifier,2009-04-24,recommended,http://rs.tdwg.org/dwc/terms/identificationQualifier,http://rs.tdwg.org/dwc/terms/version/identificationQualifier-2009-04-24,http://rs.tdwg.org/dwc/dwcore/version/IdentificationQualifier-2007-04-17,http://www.w3.org/1999/02/22-rdf-syntax-ns#Property,"A brief phrase or a standard term (""cf."", ""aff."") to express the determiner's doubts about the Identification."
Identification References,2009-04-24,superseded,http://rs.tdwg.org/dwc/terms/identificationReferences,http://rs.tdwg.org/dwc/terms/version/identificationReferences-2009-04-24,,http://www.w3.org/1999/02/22-rdf-syntax-ns#Property,"A list (concatenated and separated) of references (publication, global unique identifier, URI) used in the Identification."
Identification References,2014-10-23,recommended,http://rs.tdwg.org/dwc/terms/identificationReferences,http://rs.tdwg.org/dwc/terms/version/identificationReferences-2014-10-23,http://rs.tdwg.org/dwc/terms/version/identificationReferences-2009-04-24,http://www.w3.org/1999/02/22-rdf-syntax-ns#Property,"A list (concatenated and separated) of references (publication, global unique identifier, URI) used in the Identification."
Identification Remarks,2009-04-24,recommended,http://rs.tdwg.org/dwc/terms/identificationRemarks,http://rs.tdwg.org/dwc/terms/version/identificationRemarks-2009-04-24,,http://www.w3.org/1999/02/22-rdf-syntax-ns#Property,Comments or notes about the Identification.
Identification Verification Status,2011-10-16,recommended,http://rs.tdwg.org/dwc/terms/identificationVerificationStatus,http://rs.tdwg.org/dwc/terms/version/identificationVerificationStatus-2011-10-16,,http://www.w3.org/1999/02/22-rdf-syntax-ns#Property,A categorical indicator of the extent to which the taxonomic identification has been verified to be correct. Recommended best practice is to use a controlled vocabulary such as that used in HISPID/ABCD.
Identified By,2009-04-24,superseded,http://rs.tdwg.org/dwc/terms/identifiedBy,http://rs.tdwg.org/dwc/terms/version/identifiedBy-2009-04-24,http://rs.tdwg.org/dwc/curatorial/version/IdentifiedBy-2007-04-17,http://www.w3.org/1999/02/22-rdf-syntax-ns#Property,"A list (concatenated and separated) of names of people, groups, or organizations who assigned the scientificName."
Identified By,2009-08-24,superseded,http://rs.tdwg.org/dwc/terms/identifiedBy,http://rs.tdwg.org/dwc/terms/version/identifiedBy-2009-08-24,http://rs.tdwg.org/dwc/terms/version/identifiedBy-2009-04-24,http://www.w3.org/1999/02/22-rdf-syntax-ns#Property,"A list (concatenated and separated) of names of people, groups, or organizations who assigned the Taxon to the subject."
Identified By,2014-10-23,recommended,http://rs.tdwg.org/dwc/terms/identifiedBy,http://rs.tdwg.org/dwc/terms/version/identifiedBy-2014-10-23,http://rs.tdwg.org/dwc/terms/version/identifiedBy-2009-08-24,http://www.w3.org/1999/02/22-rdf-syntax-ns#Property,"A list (concatenated and separated) of names of people, groups, or organizations who assigned the Taxon to the subject."
Individual Count,2009-04-24,recommended,http://rs.tdwg.org/dwc/terms/individualCount,http://rs.tdwg.org/dwc/terms/version/individualCount-2009-04-24,http://rs.tdwg.org/dwc/curatorial/version/IndividualCount-2007-04-17,http://www.w3.org/1999/02/22-rdf-syntax-ns#Property,The number of individuals represented present at the time of the Occurrence.
Individual ID,2009-04-24,deprecated,http://rs.tdwg.org/dwc/terms/individualID,http://rs.tdwg.org/dwc/terms/version/individualID-2009-04-24,,http://www.w3.org/1999/02/22-rdf-syntax-ns#Property,An identifier for an individual or named group of individual organisms represented in the Occurrence. Meant to accommodate resampling of the same individual or group for monitoring purposes. May be a global unique identifier or an identifier specific to a data set.
Information Withheld,2009-04-24,recommended,http://rs.tdwg.org/dwc/terms/informationWithheld,http://rs.tdwg.org/dwc/terms/version/informationWithheld-2009-04-24,http://rs.tdwg.org/dwc/dwcore/version/InformationWithheld-2007-04-17,http://www.w3.org/1999/02/22-rdf-syntax-ns#Property,"Additional information that exists, but that has not been shared in the given record."
Infraspecific Epithet,2009-04-24,superseded,http://rs.tdwg.org/dwc/terms/infraspecificEpithet,http://rs.tdwg.org/dwc/terms/version/infraspecificEpithet-2009-04-24,http://rs.tdwg.org/dwc/dwcore/version/InfraspecificEpithet-2007-04-17,http://www.w3.org/1999/02/22-rdf-syntax-ns#Property,The name of the second or subspecies epithet of the scientificName.
Infraspecific Epithet,2009-08-24,recommended,http://rs.tdwg.org/dwc/terms/infraspecificEpithet,http://rs.tdwg.org/dwc/terms/version/infraspecificEpithet-2009-08-24,http://rs.tdwg.org/dwc/terms/version/infraspecificEpithet-2009-04-24,http://www.w3.org/1999/02/22-rdf-syntax-ns#Property,"The name of the lowest or terminal infraspecific epithet of the scientificName, excluding any rank designation."
Institution Code,2009-04-24,superseded,http://rs.tdwg.org/dwc/terms/institutionCode,http://rs.tdwg.org/dwc/terms/version/institutionCode-2009-04-24,http://rs.tdwg.org/dwc/dwcore/version/InstitutionCode-2007-04-17,http://www.w3.org/1999/02/22-rdf-syntax-ns#Property,The name (or acronym) in use by the institution having custody of the object(s) or information referred to in the record.
Institution Code,2009-08-24,superseded,http://rs.tdwg.org/dwc/terms/institutionCode,http://rs.tdwg.org/dwc/terms/version/institutionCode-2009-08-24,http://rs.tdwg.org/dwc/terms/version/institutionCode-2009-04-24,http://www.w3.org/1999/02/22-rdf-syntax-ns#Property,The name (or acronym) in use by the institution having custody of the object(s) or information referred to in the record.
Institution Code,2009-09-11,recommended,http://rs.tdwg.org/dwc/terms/institutionCode,http://rs.tdwg.org/dwc/terms/version/institutionCode-2009-09-11,http://rs.tdwg.org/dwc/terms/version/institutionCode-2009-08-24,http://www.w3.org/1999/02/22-rdf-syntax-ns#Property,The name (or acronym) in use by the institution having custody of the object(s) or information referred to in the record.
Institution ID,2009-09-11,recommended,http://rs.tdwg.org/dwc/terms/institutionID,http://rs.tdwg.org/dwc/terms/version/institutionID-2009-09-11,,http://www.w3.org/1999/02/22-rdf-syntax-ns#Property,An identifier for the institution having custody of the object(s) or information referred to in the record.
Island,2009-04-24,recommended,http://rs.tdwg.org/dwc/terms/island,http://rs.tdwg.org/dwc/terms/version/island-2009-04-24,http://rs.tdwg.org/dwc/dwcore/version/Island-2007-04-17,http://www.w3.org/1999/02/22-rdf-syntax-ns#Property,The name of the island on or near which the Location occurs. Recommended best practice is to use a controlled vocabulary such as the Getty Thesaurus of Geographic Names.
Island Group,2009-04-24,recommended,http://rs.tdwg.org/dwc/terms/islandGroup,http://rs.tdwg.org/dwc/terms/version/islandGroup-2009-04-24,http://rs.tdwg.org/dwc/dwcore/version/IslandGroup-2007-04-17,http://www.w3.org/1999/02/22-rdf-syntax-ns#Property,The name of the island group in which the Location occurs. Recommended best practice is to use a controlled vocabulary such as the Getty Thesaurus of Geographic Names.
Kingdom,2009-04-24,superseded,http://rs.tdwg.org/dwc/terms/kingdom,http://rs.tdwg.org/dwc/terms/version/kingdom-2009-04-24,http://rs.tdwg.org/dwc/dwcore/version/Kingdom-2007-04-17,http://www.w3.org/1999/02/22-rdf-syntax-ns#Property,The name of the kingdom in which the scientificName is classified.
Kingdom,2009-08-24,recommended,http://rs.tdwg.org/dwc/terms/kingdom,http://rs.tdwg.org/dwc/terms/version/kingdom-2009-08-24,http://rs.tdwg.org/dwc/terms/version/kingdom-2009-04-24,http://www.w3.org/1999/02/22-rdf-syntax-ns#Property,The full scientific name of the kingdom in which the taxon is classified.
Latest AgeOr Highest Stage,2009-04-24,recommended,http://rs.tdwg.org/dwc/terms/latestAgeOrHighestStage,http://rs.tdwg.org/dwc/terms/version/latestAgeOrHighestStage-2009-04-24,http://digir.net/schema/conceptual/darwin/extension/paleontology/1.0/version/LatestAgeOrHighestStage-2005-07-03,http://www.w3.org/1999/02/22-rdf-syntax-ns#Property,The full name of the latest possible geochronologic age or highest chronostratigraphic stage attributable to the stratigraphic horizon from which the cataloged item was collected.
Latest Date Collected,2008-11-19,deprecated,http://rs.tdwg.org/dwc/terms/LatestDateCollected,http://rs.tdwg.org/dwc/terms/version/LatestDateCollected-2008-11-19,http://rs.tdwg.org/dwc/dwcore/version/LatestDateCollected-2007-04-17,http://www.w3.org/1999/02/22-rdf-syntax-ns#Property,"The latest date-time in a period during which a event occurred. If the event is recorded as occurring at a single date-time, populate both EarliestDateCollected and LatestDateCollected with the same value. Recommended best practice is to use an encoding scheme, such as ISO 8601:2004(E)."
Latest Eon Or Highest Eonothem,2009-04-24,recommended,http://rs.tdwg.org/dwc/terms/latestEonOrHighestEonothem,http://rs.tdwg.org/dwc/terms/version/latestEonOrHighestEonothem-2009-04-24,http://rs.tdwg.org/dwc/terms/version/LatestEonOrLowestEonothem-2005-07-03,http://www.w3.org/1999/02/22-rdf-syntax-ns#Property,"The full name of the latest possible geochronologic eon or highest chrono-stratigraphic eonothem or the informal name (""Precambrian"") attributable to the stratigraphic horizon from which the cataloged item was collected."
Latest Epoch Or Highest Series,2009-04-24,recommended,http://rs.tdwg.org/dwc/terms/latestEpochOrHighestSeries,http://rs.tdwg.org/dwc/terms/version/latestEpochOrHighestSeries-2009-04-24,http://digir.net/schema/conceptual/darwin/extension/paleontology/1.0/version/LatestEpochOrHighestSeries-2005-07-03,http://www.w3.org/1999/02/22-rdf-syntax-ns#Property,The full name of the latest possible geochronologic epoch or highest chronostratigraphic series attributable to the stratigraphic horizon from which the cataloged item was collected.
Latest Era Or Highest Erathem,2009-04-24,recommended,http://rs.tdwg.org/dwc/terms/latestEraOrHighestErathem,http://rs.tdwg.org/dwc/terms/version/latestEraOrHighestErathem-2009-04-24,http://digir.net/schema/conceptual/darwin/extension/paleontology/1.0/version/LatestEraOrHighestErathem-2005-07-03,http://www.w3.org/1999/02/22-rdf-syntax-ns#Property,The full name of the latest possible geochronologic era or highest chronostratigraphic erathem attributable to the stratigraphic horizon from which the cataloged item was collected.
Latest Period Or Highest System,2009-04-24,recommended,http://rs.tdwg.org/dwc/terms/latestPeriodOrHighestSystem,http://rs.tdwg.org/dwc/terms/version/latestPeriodOrHighestSystem-2009-04-24,http://digir.net/schema/conceptual/darwin/extension/paleontology/1.0/version/LatestPeriodOrHighestSystem-2005-07-03,http://www.w3.org/1999/02/22-rdf-syntax-ns#Property,The full name of the latest possible geochronologic period or highest chronostratigraphic system attributable to the stratigraphic horizon from which the cataloged item was collected.
Life Stage,2009-04-24,recommended,http://rs.tdwg.org/dwc/terms/lifeStage,http://rs.tdwg.org/dwc/terms/version/lifeStage-2009-04-24,http://rs.tdwg.org/dwc/dwcore/version/LifeStage-2007-04-17,http://www.w3.org/1999/02/22-rdf-syntax-ns#Property,The age class or life stage of the biological individual(s) at the time the Occurrence was recorded. Recommended best practice is to use a controlled vocabulary.
Lithostratigraphic Terms,2009-04-24,recommended,http://rs.tdwg.org/dwc/terms/lithostratigraphicTerms,http://rs.tdwg.org/dwc/terms/version/lithostratigraphicTerms-2009-04-24,http://digir.net/schema/conceptual/darwin/extension/paleontology/1.0/version/LithostratigraphicTerms-2005-07-03,http://www.w3.org/1999/02/22-rdf-syntax-ns#Property,The combination of all litho-stratigraphic names for the rock from which the cataloged item was collected.
Living Specimen,2014-10-23,recommended,http://rs.tdwg.org/dwc/terms/LivingSpecimen,http://rs.tdwg.org/dwc/terms/version/LivingSpecimen-2014-10-23,http://rs.tdwg.org/dwc/dwctype/version/LivingSpecimen-2011-10-16,http://www.w3.org/2000/01/rdf-schema#Class,A specimen that is alive.
Locality,2009-04-24,recommended,http://rs.tdwg.org/dwc/terms/locality,http://rs.tdwg.org/dwc/terms/version/locality-2009-04-24,http://rs.tdwg.org/dwc/dwcore/version/Locality-2007-04-17,http://www.w3.org/1999/02/22-rdf-syntax-ns#Property,"The specific description of the place. Less specific geographic information can be provided in other geographic terms (higherGeography, continent, country, stateProvince, county, municipality, waterBody, island, islandGroup). This term may contain information modified from the original to correct perceived errors or standardize the description."
Location According To,2009-08-24,recommended,http://rs.tdwg.org/dwc/terms/locationAccordingTo,http://rs.tdwg.org/dwc/terms/version/locationAccordingTo-2009-08-24,,http://www.w3.org/1999/02/22-rdf-syntax-ns#Property,"Information about the source of this Location information. Could be a publication (gazetteer), institution, or team of individuals."
Location Attributes,2009-04-24,deprecated,http://rs.tdwg.org/dwc/terms/locationAttributes,http://rs.tdwg.org/dwc/terms/version/locationAttributes-2009-04-24,,http://www.w3.org/1999/02/22-rdf-syntax-ns#Property,"A list (concatenated and separated) of additional measurements, facts, characteristics, or assertions about the location."
Location ID,2009-04-24,recommended,http://rs.tdwg.org/dwc/terms/locationID,http://rs.tdwg.org/dwc/terms/version/locationID-2009-04-24,http://rs.tdwg.org/dwc/terms/version/SamplingLocationID-2008-11-19,http://www.w3.org/1999/02/22-rdf-syntax-ns#Property,An identifier for the set of location information (data associated with dcterms:Location). May be a global unique identifier or an identifier specific to the data set.
Location Remarks,2009-04-24,recommended,http://rs.tdwg.org/dwc/terms/locationRemarks,http://rs.tdwg.org/dwc/terms/version/locationRemarks-2009-04-24,http://rs.tdwg.org/dwc/terms/version/SamplingLocationRemarks-2009-01-18,http://www.w3.org/1999/02/22-rdf-syntax-ns#Property,Comments or notes about the Location.
Lowest Biostratigraphic Zone,2009-04-24,recommended,http://rs.tdwg.org/dwc/terms/lowestBiostratigraphicZone,http://rs.tdwg.org/dwc/terms/version/lowestBiostratigraphicZone-2009-04-24,http://digir.net/schema/conceptual/darwin/extension/paleontology/1.0/version/LowestBiostratigraphicZone-2005-07-03,http://www.w3.org/1999/02/22-rdf-syntax-ns#Property,The full name of the lowest possible geological biostratigraphic zone of the stratigraphic horizon from which the cataloged item was collected.
Machine Observation,2014-10-23,recommended,http://rs.tdwg.org/dwc/terms/MachineObservation,http://rs.tdwg.org/dwc/terms/version/MachineObservation-2014-10-23,http://rs.tdwg.org/dwc/dwctype/version/MachineObservation-2011-10-16,http://www.w3.org/2000/01/rdf-schema#Class,An output of a machine observation process.
Material Sample,2013-03-28,superseded,http://rs.tdwg.org/dwc/terms/MaterialSample,http://rs.tdwg.org/dwc/terms/version/MaterialSample-2013-03-28,,http://www.w3.org/2000/01/rdf-schema#Class,"The category of information pertaining to the physical results of a sampling (or subsampling) event. In biological collections, the material sample is typically collected, and either preserved or destructively processed."
Material Sample,2014-10-23,recommended,http://rs.tdwg.org/dwc/terms/MaterialSample,http://rs.tdwg.org/dwc/terms/version/MaterialSample-2014-10-23,http://rs.tdwg.org/dwc/terms/version/MaterialSample-2013-03-28,http://www.w3.org/2000/01/rdf-schema#Class,"A physical results of a sampling (or subsampling) event. In biological collections, the material sample is typically collected, and either preserved or destructively processed."
Material Sample ID,2013-05-25,recommended,http://rs.tdwg.org/dwc/terms/materialSampleID,http://rs.tdwg.org/dwc/terms/version/materialSampleID-2013-05-25,http://gensc.org/ns/mixs/version/source_mat_id-2011-01-26,http://www.w3.org/1999/02/22-rdf-syntax-ns#Property,"An identifier for the MaterialSample (as opposed to a particular digital record of the material sample). In the absence of a persistent global unique identifier, construct one from a combination of identifiers in the record that will most closely make the materialSampleID globally unique."
Maximum Depth In Meters,2009-04-24,recommended,http://rs.tdwg.org/dwc/terms/maximumDepthInMeters,http://rs.tdwg.org/dwc/terms/version/maximumDepthInMeters-2009-04-24,http://rs.tdwg.org/dwc/dwcore/version/MaximumDepthInMeters-2007-04-17,http://www.w3.org/1999/02/22-rdf-syntax-ns#Property,"The greater depth of a range of depth below the local surface, in meters."
Maximum Distance Above Surface In Meters,2009-04-24,recommended,http://rs.tdwg.org/dwc/terms/maximumDistanceAboveSurfaceInMeters,http://rs.tdwg.org/dwc/terms/version/maximumDistanceAboveSurfaceInMeters-2009-04-24,,http://www.w3.org/1999/02/22-rdf-syntax-ns#Property,"The greater distance in a range of distance from a reference surface in the vertical direction, in meters. Use positive values for locations above the surface, negative values for locations below. If depth measures are given, the reference surface is the location given by the depth, otherwise the reference surface is the location given by the elevation."
Maximum Elevation In Meters,2009-04-24,recommended,http://rs.tdwg.org/dwc/terms/maximumElevationInMeters,http://rs.tdwg.org/dwc/terms/version/maximumElevationInMeters-2009-04-24,http://rs.tdwg.org/dwc/dwcore/version/MaximumElevationInMeters-2007-04-17,http://www.w3.org/1999/02/22-rdf-syntax-ns#Property,"The upper limit of the range of elevation (altitude, usually above sea level), in meters."
Measurement Accuracy,2009-04-24,recommended,http://rs.tdwg.org/dwc/terms/measurementAccuracy,http://rs.tdwg.org/dwc/terms/version/measurementAccuracy-2009-04-24,"http://rs.tdwg.org/dwc/terms/version/occurrenceMeasurementAccuracy-2009-04-24|http://rs.tdwg.org/dwc/terms/version/eventMeasurementAccuracy-2009-04-24
",http://www.w3.org/1999/02/22-rdf-syntax-ns#Property,The description of the potential error associated with the measurementValue.
Measurement Determined By,2009-04-24,superseded,http://rs.tdwg.org/dwc/terms/measurementDeterminedBy,http://rs.tdwg.org/dwc/terms/version/measurementDeterminedBy-2009-04-24,"http://rs.tdwg.org/dwc/terms/version/occurrenceMeasurementDeterminedBy-2009-04-24|http://rs.tdwg.org/dwc/terms/version/eventMeasurementDeterminedBy-2009-04-24
",http://www.w3.org/1999/02/22-rdf-syntax-ns#Property,"A list (concatenated and separated) of names of people, groups, or organizations who determined the value of the MeasurementOrFact."
Measurement Determined By,2014-10-23,recommended,http://rs.tdwg.org/dwc/terms/measurementDeterminedBy,http://rs.tdwg.org/dwc/terms/version/measurementDeterminedBy-2014-10-23,http://rs.tdwg.org/dwc/terms/version/measurementDeterminedBy-2009-04-24,http://www.w3.org/1999/02/22-rdf-syntax-ns#Property,"A list (concatenated and separated) of names of people, groups, or organizations who determined the value of the MeasurementOrFact."
Measurement Determined Date,2009-04-24,recommended,http://rs.tdwg.org/dwc/terms/measurementDeterminedDate,http://rs.tdwg.org/dwc/terms/version/measurementDeterminedDate-2009-04-24,"http://rs.tdwg.org/dwc/terms/version/occurrenceMeasurementDeterminedDate-2009-04-24|http://rs.tdwg.org/dwc/terms/version/eventMeasurementDeterminedDate-2009-04-24
",http://www.w3.org/1999/02/22-rdf-syntax-ns#Property,"The date on which the MeasurementOrFact was made. Recommended best practice is to use an encoding scheme, such as ISO 8601:2004(E)."
Measurement ID,2009-04-24,recommended,http://rs.tdwg.org/dwc/terms/measurementID,http://rs.tdwg.org/dwc/terms/version/measurementID-2009-04-24,"http://rs.tdwg.org/dwc/terms/version/occurrenceMeasurementID-2009-04-24|http://rs.tdwg.org/dwc/terms/version/eventMeasurementID-2009-04-24
",http://www.w3.org/1999/02/22-rdf-syntax-ns#Property,"An identifier for the MeasurementOrFact (information pertaining to measurements, facts, characteristics, or assertions). May be a global unique identifier or an identifier specific to the data set."
Measurement Method,2009-04-24,recommended,http://rs.tdwg.org/dwc/terms/measurementMethod,http://rs.tdwg.org/dwc/terms/version/measurementMethod-2009-04-24,,http://www.w3.org/1999/02/22-rdf-syntax-ns#Property,"A description of or reference to (publication, URI) the method or protocol used to determine the measurement, fact, characteristic, or assertion."
Measurement Or Fact,2009-04-24,superseded,http://rs.tdwg.org/dwc/terms/MeasurementOrFact,http://rs.tdwg.org/dwc/terms/version/MeasurementOrFact-2009-04-24,"http://rs.tdwg.org/dwc/terms/version/OccurrenceMeasurement-2008-11-19|http://rs.tdwg.org/dwc/terms/version/EventMeasurement-2008-11-19
",http://www.w3.org/2000/01/rdf-schema#Class,"The category of information pertaining to measurements, facts, characteristics, or assertions about a resource (instance of data record, such as Occurrence, Taxon, Location, Event)."
Measurement or Fact,2014-10-23,recommended,http://rs.tdwg.org/dwc/terms/MeasurementOrFact,http://rs.tdwg.org/dwc/terms/version/MeasurementOrFact-2014-10-23,http://rs.tdwg.org/dwc/terms/version/MeasurementOrFact-2009-04-24,http://www.w3.org/2000/01/rdf-schema#Class,A measurement of or fact about an rdfs:Resource (http://www.w3.org/2000/01/rdf-schema#Resource).
Measurement Remarks,2009-04-24,recommended,http://rs.tdwg.org/dwc/terms/measurementRemarks,http://rs.tdwg.org/dwc/terms/version/measurementRemarks-2009-04-24,"http://rs.tdwg.org/dwc/terms/version/occurrenceMeasurementRemarks-2009-04-24|http://rs.tdwg.org/dwc/terms/version/eventMeasurementRemarks-2009-04-24
",http://www.w3.org/1999/02/22-rdf-syntax-ns#Property,Comments or notes accompanying the MeasurementOrFact.
Measurement Type,2009-04-24,recommended,http://rs.tdwg.org/dwc/terms/measurementType,http://rs.tdwg.org/dwc/terms/version/measurementType-2009-04-24,"http://rs.tdwg.org/dwc/terms/version/occurrenceMeasurementType-2009-04-24|http://rs.tdwg.org/dwc/terms/version/eventMeasurementType-2009-04-24
",http://www.w3.org/1999/02/22-rdf-syntax-ns#Property,"The nature of the measurement, fact, characteristic, or assertion. Recommended best practice is to use a controlled vocabulary."
Measurement Unit,2009-04-24,recommended,http://rs.tdwg.org/dwc/terms/measurementUnit,http://rs.tdwg.org/dwc/terms/version/measurementUnit-2009-04-24,"http://rs.tdwg.org/dwc/terms/version/occurrenceMeasurementUnit-2009-04-24|http://rs.tdwg.org/dwc/terms/version/eventMeasurementUnit-2009-04-24
",http://www.w3.org/1999/02/22-rdf-syntax-ns#Property,The units associated with the measurementValue. Recommended best practice is to use the International System of Units (SI).
Measurement Value,2009-04-24,recommended,http://rs.tdwg.org/dwc/terms/measurementValue,http://rs.tdwg.org/dwc/terms/version/measurementValue-2009-04-24,"http://rs.tdwg.org/dwc/terms/version/occurrenceMeasurementValue-2009-04-24|http://rs.tdwg.org/dwc/terms/version/eventMeasurementValue-2009-04-24
",http://www.w3.org/1999/02/22-rdf-syntax-ns#Property,"The value of the measurement, fact, characteristic, or assertion."
Member,2009-04-24,recommended,http://rs.tdwg.org/dwc/terms/member,http://rs.tdwg.org/dwc/terms/version/member-2009-04-24,http://digir.net/schema/conceptual/darwin/extension/paleontology/1.0/version/Member-2005-07-03,http://www.w3.org/1999/02/22-rdf-syntax-ns#Property,The full name of the lithostratigraphic member from which the cataloged item was collected.
Minimum Depth In Meters,2009-04-24,recommended,http://rs.tdwg.org/dwc/terms/minimumDepthInMeters,http://rs.tdwg.org/dwc/terms/version/minimumDepthInMeters-2009-04-24,http://rs.tdwg.org/dwc/dwcore/version/MinimumDepthInMeters-2007-04-17,http://www.w3.org/1999/02/22-rdf-syntax-ns#Property,"The lesser depth of a range of depth below the local surface, in meters."
Minimum Distance Above Surface In Meters,2009-04-24,recommended,http://rs.tdwg.org/dwc/terms/minimumDistanceAboveSurfaceInMeters,http://rs.tdwg.org/dwc/terms/version/minimumDistanceAboveSurfaceInMeters-2009-04-24,,http://www.w3.org/1999/02/22-rdf-syntax-ns#Property,"The lesser distance in a range of distance from a reference surface in the vertical direction, in meters. Use positive values for locations above the surface, negative values for locations below. If depth measures are given, the reference surface is the location given by the depth, otherwise the reference surface is the location given by the elevation."
