label,issued,status,term_iri,iri,replaces,rdf_type,definition
Reproductive Condition,2009-04-24,recommended,http://rs.tdwg.org/dwc/terms/reproductiveCondition,http://rs.tdwg.org/dwc/terms/version/reproductiveCondition-2009-04-24,,http://www.w3.org/1999/02/22-rdf-syntax-ns#Property,The reproductive condition of the biological individual(s) represented in the Occurrence. Recommended best practice is to use a controlled vocabulary.
Resource ID,2009-04-24,recommended,http://rs.tdwg.org/dwc/terms/resourceID,http://rs.tdwg.org/dwc/terms/version/resourceID-2009-04-24,,http://www.w3.org/1999/02/22-rdf-syntax-ns#Property,An identifier for the resource that is the subject of the relationship.
Resource Relationship,2009-01-21,superseded,http://rs.tdwg.org/dwc/terms/ResourceRelationship,http://rs.tdwg.org/dwc/terms/version/ResourceRelationship-2009-01-21,,http://www.w3.org/2000/01/rdf-schema#Class,"The category of information pertaining to relationships between resources (instances of data records, such as Occurrences, Taxa, Locations, Events)."
Resource Relationship,2014-10-23,recommended,http://rs.tdwg.org/dwc/terms/ResourceRelationship,http://rs.tdwg.org/dwc/terms/version/ResourceRelationship-2014-10-23,http://rs.tdwg.org/dwc/terms/version/ResourceRelationship-2009-01-21,http://www.w3.org/2000/01/rdf-schema#Class,A relationship of one rdfs:Resource (http://www.w3.org/2000/01/rdf-schema#Resource) to another.
Resource Relationship ID,2009-04-24,recommended,http://rs.tdwg.org/dwc/terms/resourceRelationshipID,http://rs.tdwg.org/dwc/terms/version/resourceRelationshipID-2009-04-24,,http://www.w3.org/1999/02/22-rdf-syntax-ns#Property,"An identifier for an instance of relationship between one resource (the subject) and another (relatedResource, the object)."
Sample,2008-11-19,deprecated,http://rs.tdwg.org/dwc/terms/Sample,http://rs.tdwg.org/dwc/terms/version/Sample-2008-11-19,,http://www.w3.org/2000/01/rdf-schema#Class,"Container class for information about the results of a sampling event (specimen, observation, etc.)"
Sample Attribute,2008-11-19,deprecated,http://rs.tdwg.org/dwc/terms/SampleAttribute,http://rs.tdwg.org/dwc/terms/version/SampleAttribute-2008-11-19,,http://www.w3.org/2000/01/rdf-schema#Class,Container class for information about attributes related to a given sample.
Sample Attribute Accuracy,2009-01-18,deprecated,http://rs.tdwg.org/dwc/terms/SampleAttributeAccuracy,http://rs.tdwg.org/dwc/terms/version/SampleAttributeAccuracy-2009-01-18,,http://www.w3.org/1999/02/22-rdf-syntax-ns#Property,The description of the error associated with the SampleAttributeValue.
Sample Attribute Determined By,2009-01-23,deprecated,http://rs.tdwg.org/dwc/terms/SampleAttributeDeterminedBy,http://rs.tdwg.org/dwc/terms/version/SampleAttributeDeterminedBy-2009-01-23,,http://www.w3.org/1999/02/22-rdf-syntax-ns#Property,The agent responsible for having determined the value of the measurement or characteristic of the sample.
Sample Attribute Determined Date,2009-01-23,deprecated,http://rs.tdwg.org/dwc/terms/SampleAttributeDeterminedDate,http://rs.tdwg.org/dwc/terms/version/SampleAttributeDeterminedDate-2009-01-23,,http://www.w3.org/1999/02/22-rdf-syntax-ns#Property,The date on which the the measurement or characteristic of the sample was made.
Sample Attribute Remarks,2008-11-19,deprecated,http://rs.tdwg.org/dwc/terms/SampleAttributeRemarks,http://rs.tdwg.org/dwc/terms/version/SampleAttributeRemarks-2008-11-19,,http://www.w3.org/1999/02/22-rdf-syntax-ns#Property,Comments or notes accompanying the measurement or characteristic of the sample.
Sample Attribute Unit,2008-11-19,deprecated,http://rs.tdwg.org/dwc/terms/SampleAttributeUnit,http://rs.tdwg.org/dwc/terms/version/SampleAttributeUnit-2008-11-19,,http://www.w3.org/1999/02/22-rdf-syntax-ns#Property,The units for the value of the measurement or characteristic of the sample. Recommended best practice is to use International System of Units (SI) units.
Sample Attribute Value,2008-11-19,deprecated,http://rs.tdwg.org/dwc/terms/SampleAttributeValue,http://rs.tdwg.org/dwc/terms/version/SampleAttributeValue-2008-11-19,,http://www.w3.org/1999/02/22-rdf-syntax-ns#Property,The value of the measurement or characteristic of the sample.
Sample Remarks,2009-01-18,deprecated,http://rs.tdwg.org/dwc/terms/SampleRemarks,http://rs.tdwg.org/dwc/terms/version/SampleRemarks-2009-01-18,http://rs.tdwg.org/dwc/dwcore/version/Remarks-2007-04-17,http://www.w3.org/1999/02/22-rdf-syntax-ns#Property,Comments or notes about the sample or record.
Sample Size Unit,2014-12-23,recommended,http://rs.tdwg.org/dwc/terms/sampleSizeUnit,http://rs.tdwg.org/dwc/terms/version/sampleSizeUnit-2014-12-23,,http://www.w3.org/1999/02/22-rdf-syntax-ns#Property,"The unit of measurement of the size (time duration, length, area, or volume) of a sample in a sampling event."
Sample Size Value,2014-12-23,recommended,http://rs.tdwg.org/dwc/terms/sampleSizeValue,http://rs.tdwg.org/dwc/terms/version/sampleSizeValue-2014-12-23,,http://www.w3.org/1999/02/22-rdf-syntax-ns#Property,"A numeric value for a measurement of the size (time duration, length, area, or volume) of a sample in a sampling event."
Sample Attribute ID,2008-11-19,deprecated,http://rs.tdwg.org/dwc/terms/SamplingAttributeID,http://rs.tdwg.org/dwc/terms/version/SamplingAttributeID-2008-11-19,,http://www.w3.org/1999/02/22-rdf-syntax-ns#Property,An identifier for the sampling attribute. May be a global unique identifier or an identifier specific to the data set.
Sample Attribute Type,2008-11-19,deprecated,http://rs.tdwg.org/dwc/terms/SamplingAttributeType,http://rs.tdwg.org/dwc/terms/version/SamplingAttributeType-2008-11-19,"http://rs.tdwg.org/dwc/terms/version/EventAttributeType-2008-11-19|http://rs.tdwg.org/dwc/terms/version/SampleAttributeType-2008-11-19
",http://www.w3.org/1999/02/22-rdf-syntax-ns#Property,The nature of the measurement or characteristic of the sample. Recommended best practice is to use a controlled vocabulary.
Sampling Effort,2009-08-24,recommended,http://rs.tdwg.org/dwc/terms/samplingEffort,http://rs.tdwg.org/dwc/terms/version/samplingEffort-2009-08-24,,http://www.w3.org/1999/02/22-rdf-syntax-ns#Property,The amount of effort expended during an Event.
Sampling Event,2008-11-19,deprecated,http://rs.tdwg.org/dwc/terms/SamplingEvent,http://rs.tdwg.org/dwc/terms/version/SamplingEvent-2008-11-19,,http://www.w3.org/2000/01/rdf-schema#Class,Container class for information about the conditions and methods of acquisition of samples.
Sampling Event Attributes,2008-11-19,deprecated,http://rs.tdwg.org/dwc/terms/SamplingEventAttributes,http://rs.tdwg.org/dwc/terms/version/SamplingEventAttributes-2008-11-19,,http://www.w3.org/1999/02/22-rdf-syntax-ns#Property,A list (concatenated and separated) of additional measurements or characteristics of the sampling event.
Sampling Event ID,2008-11-19,deprecated,http://rs.tdwg.org/dwc/terms/SamplingEventID,http://rs.tdwg.org/dwc/terms/version/SamplingEventID-2008-11-19,,http://www.w3.org/1999/02/22-rdf-syntax-ns#Property,An identifier for the sampling event. May be a global unique identifier or an identifier specific to the data set.
Sampling Event Remarks,2009-01-18,deprecated,http://rs.tdwg.org/dwc/terms/SamplingEventRemarks,http://rs.tdwg.org/dwc/terms/version/SamplingEventRemarks-2009-01-18,,http://www.w3.org/1999/02/22-rdf-syntax-ns#Property,Comments or notes about the sampling event.
Sampling Location,2008-11-19,deprecated,http://rs.tdwg.org/dwc/terms/SamplingLocation,http://rs.tdwg.org/dwc/terms/version/SamplingLocation-2008-11-19,,http://www.w3.org/2000/01/rdf-schema#Class,Container class for information about the location where a sampling event occurred.
Sampling Location ID,2008-11-19,deprecated,http://rs.tdwg.org/dwc/terms/SamplingLocationID,http://rs.tdwg.org/dwc/terms/version/SamplingLocationID-2008-11-19,,http://www.w3.org/1999/02/22-rdf-syntax-ns#Property,An identifier for the sampling location. May be a global unique identifier or an identifier specific to the data set.
Sampling Location Remarks,2009-01-18,deprecated,http://rs.tdwg.org/dwc/terms/SamplingLocationRemarks,http://rs.tdwg.org/dwc/terms/version/SamplingLocationRemarks-2009-01-18,,http://www.w3.org/1999/02/22-rdf-syntax-ns#Property,Comments or notes about the sampling location.
Sampling Protocol,2009-04-24,recommended,http://rs.tdwg.org/dwc/terms/samplingProtocol,http://rs.tdwg.org/dwc/terms/version/samplingProtocol-2009-04-24,http://rs.tdwg.org/dwc/dwcore/version/CollectingMethod-2007-04-17,http://www.w3.org/1999/02/22-rdf-syntax-ns#Property,"The name of, reference to, or description of the method or protocol used during an Event."
Scientific Name,2009-04-24,superseded,http://rs.tdwg.org/dwc/terms/scientificName,http://rs.tdwg.org/dwc/terms/version/scientificName-2009-04-24,http://rs.tdwg.org/dwc/dwcore/version/ScientificName-2007-04-17,http://www.w3.org/1999/02/22-rdf-syntax-ns#Property,"The taxon name (with date and authorship information if applicable). When forming part of an Identification, this should be the name in lowest level taxonomic rank that can be determined. This term should not contain identification qualifications, which should instead be supplied in the IdentificationQualifier term."
Scientific Name,2009-09-21,recommended,http://rs.tdwg.org/dwc/terms/scientificName,http://rs.tdwg.org/dwc/terms/version/scientificName-2009-09-21,http://rs.tdwg.org/dwc/terms/version/scientificName-2009-04-24,http://www.w3.org/1999/02/22-rdf-syntax-ns#Property,"The full scientific name, with authorship and date information if known. When forming part of an Identification, this should be the name in lowest level taxonomic rank that can be determined. This term should not contain identification qualifications, which should instead be supplied in the IdentificationQualifier term."
Scientific Name Authorship,2009-04-24,recommended,http://rs.tdwg.org/dwc/terms/scientificNameAuthorship,http://rs.tdwg.org/dwc/terms/version/scientificNameAuthorship-2009-04-24,http://rs.tdwg.org/dwc/dwcore/version/AuthorYearOfScientificName-2007-04-17,http://www.w3.org/1999/02/22-rdf-syntax-ns#Property,The authorship information for the scientificName formatted according to the conventions of the applicable nomenclaturalCode.
Scientific Name ID,2009-07-06,superseded,http://rs.tdwg.org/dwc/terms/scientificNameID,http://rs.tdwg.org/dwc/terms/version/scientificNameID-2009-07-06,http://rs.tdwg.org/dwc/terms/version/taxonNameID-2009-04-24,http://www.w3.org/1999/02/22-rdf-syntax-ns#Property,A unique identifier for the scientificName.
Scientific Name ID,2009-08-24,recommended,http://rs.tdwg.org/dwc/terms/scientificNameID,http://rs.tdwg.org/dwc/terms/version/scientificNameID-2009-08-24,http://rs.tdwg.org/dwc/terms/version/TaxonNameID-2009-04-24,http://www.w3.org/1999/02/22-rdf-syntax-ns#Property,An identifier for the nomenclatural (not taxonomic) details of a scientific name.
Scientific Name Rank,2009-07-06,deprecated,http://rs.tdwg.org/dwc/terms/scientificNameRank,http://rs.tdwg.org/dwc/terms/version/scientificNameRank-2009-07-06,http://rs.tdwg.org/dwc/terms/version/taxonRank-2009-04-24,http://www.w3.org/1999/02/22-rdf-syntax-ns#Property,The taxonomic rank of the most specific name in the scientificName. Recommended best practice is to use a controlled vocabulary.
Sex,2009-04-24,recommended,http://rs.tdwg.org/dwc/terms/sex,http://rs.tdwg.org/dwc/terms/version/sex-2009-04-24,http://rs.tdwg.org/dwc/dwcore/version/Sex-2007-04-17,http://www.w3.org/1999/02/22-rdf-syntax-ns#Property,The sex of the biological individual(s) represented in the Occurrence. Recommended best practice is to use a controlled vocabulary.
Specific Epithet,2009-04-24,recommended,http://rs.tdwg.org/dwc/terms/specificEpithet,http://rs.tdwg.org/dwc/terms/version/specificEpithet-2009-04-24,http://rs.tdwg.org/dwc/dwcore/version/SpecificEpithet-2007-04-17,http://www.w3.org/1999/02/22-rdf-syntax-ns#Property,The name of the first or species epithet of the scientificName.
Start Day Of Year,2009-04-24,recommended,http://rs.tdwg.org/dwc/terms/startDayOfYear,http://rs.tdwg.org/dwc/terms/version/startDayOfYear-2009-04-24,http://rs.tdwg.org/dwc/dwcore/version/DayOfYear-2007-04-17,http://www.w3.org/1999/02/22-rdf-syntax-ns#Property,"The earliest ordinal day of the year on which the Event occurred (1 for January 1, 365 for December 31, except in a leap year, in which case it is 366)."
Start Time of Day,2008-11-19,deprecated,http://rs.tdwg.org/dwc/terms/StartTimeOfDay,http://rs.tdwg.org/dwc/terms/version/StartTimeOfDay-2008-11-19,http://www.iobis.org/obis/version/StartTimeOfDay-2005-07-10,http://www.w3.org/1999/02/22-rdf-syntax-ns#Property,"The time of day when the event began, expressed as decimal hours from midnight, local time."
State Province,2009-04-24,recommended,http://rs.tdwg.org/dwc/terms/stateProvince,http://rs.tdwg.org/dwc/terms/version/stateProvince-2009-04-24,http://rs.tdwg.org/dwc/dwcore/version/StateProvince-2007-04-17,http://www.w3.org/1999/02/22-rdf-syntax-ns#Property,"The name of the next smaller administrative region than country (state, province, canton, department, region, etc.) in which the Location occurs."
Subgenus,2009-04-24,superseded,http://rs.tdwg.org/dwc/terms/subgenus,http://rs.tdwg.org/dwc/terms/version/subgenus-2009-04-24,http://www.iobis.org/obis/version/Subgenus-2005-07-10,http://www.w3.org/1999/02/22-rdf-syntax-ns#Property,The name of the subgenus in which the scientificName is classified.
Subgenus,2009-08-24,recommended,http://rs.tdwg.org/dwc/terms/subgenus,http://rs.tdwg.org/dwc/terms/version/subgenus-2009-08-24,http://rs.tdwg.org/dwc/terms/version/subgenus-2009-04-24,http://www.w3.org/1999/02/22-rdf-syntax-ns#Property,The full scientific name of the subgenus in which the taxon is classified. Values should include the genus to avoid homonym confusion.
Taxon,2008-11-19,superseded,http://rs.tdwg.org/dwc/terms/Taxon,http://rs.tdwg.org/dwc/terms/version/Taxon-2008-11-19,,http://www.w3.org/2000/01/rdf-schema#Class,The category of information pertaining to taxonomic names or concepts.
Taxon,2009-09-21,superseded,http://rs.tdwg.org/dwc/terms/Taxon,http://rs.tdwg.org/dwc/terms/version/Taxon-2009-09-21,http://rs.tdwg.org/dwc/terms/version/Taxon-2008-11-19,http://www.w3.org/2000/01/rdf-schema#Class,"The category of information pertaining to taxonomic names, taxon name usages, or taxon concepts."
Taxon,2014-10-23,recommended,http://rs.tdwg.org/dwc/terms/Taxon,http://rs.tdwg.org/dwc/terms/version/Taxon-2014-10-23,http://rs.tdwg.org/dwc/terms/version/Taxon-2009-09-21,http://www.w3.org/2000/01/rdf-schema#Class,A group of organisms (sensu http://purl.obolibrary.org/obo/OBI_0100026) considered by taxonomists to form a homogeneous unit.
Taxon According To,2009-04-24,deprecated,http://rs.tdwg.org/dwc/terms/taxonAccordingTo,http://rs.tdwg.org/dwc/terms/version/taxonAccordingTo-2009-04-24,,http://www.w3.org/1999/02/22-rdf-syntax-ns#Property,"Information about the authorship of this taxon concept which uses the scientificName in their sense (secundum, sensu). Could be a publication (identification key), institution or team of individuals."
Taxon Attributes,2009-04-24,deprecated,http://rs.tdwg.org/dwc/terms/taxonAttributes,http://rs.tdwg.org/dwc/terms/version/taxonAttributes-2009-04-24,,http://www.w3.org/1999/02/22-rdf-syntax-ns#Property,"A list (concatenated and separated) of additional measurements, facts, characteristics, or assertions about the taxon."
Taxon Concept ID,2009-04-24,superseded,http://rs.tdwg.org/dwc/terms/taxonConceptID,http://rs.tdwg.org/dwc/terms/version/taxonConceptID-2009-04-24,,http://www.w3.org/1999/02/22-rdf-syntax-ns#Property,A unique identifier for the taxon concept (a circumscription of a taxonName).
Taxon Concept ID,2009-09-21,recommended,http://rs.tdwg.org/dwc/terms/taxonConceptID,http://rs.tdwg.org/dwc/terms/version/taxonConceptID-2009-09-21,http://rs.tdwg.org/dwc/terms/version/taxonConceptID-2009-04-24,http://www.w3.org/1999/02/22-rdf-syntax-ns#Property,An identifier for the taxonomic concept to which the record refers - not for the nomenclatural details of a taxon.
Taxon ID,2008-11-19,deprecated,http://rs.tdwg.org/dwc/terms/TaxonID,http://rs.tdwg.org/dwc/terms/version/TaxonID-2008-11-19,,http://www.w3.org/1999/02/22-rdf-syntax-ns#Property,A global unique identifier for the taxon (name in a classification).
Taxon ID,2009-08-24,recommended,http://rs.tdwg.org/dwc/terms/taxonID,http://rs.tdwg.org/dwc/terms/version/taxonID-2009-08-24,http://rs.tdwg.org/dwc/terms/version/scientificNameID-2009-07-06,http://www.w3.org/1999/02/22-rdf-syntax-ns#Property,An identifier for the set of taxon information (data associated with the Taxon class). May be a global unique identifier or an identifier specific to the data set.
Taxon Name ID,2009-04-24,deprecated,http://rs.tdwg.org/dwc/terms/taxonNameID,http://rs.tdwg.org/dwc/terms/version/taxonNameID-2009-04-24,http://rs.tdwg.org/dwc/terms/version/TaxonID-2008-11-19,http://www.w3.org/1999/02/22-rdf-syntax-ns#Property,A unique identifier for the scientificName.
Taxonomic Status,2009-04-24,recommended,http://rs.tdwg.org/dwc/terms/taxonomicStatus,http://rs.tdwg.org/dwc/terms/version/taxonomicStatus-2009-04-24,,http://www.w3.org/1999/02/22-rdf-syntax-ns#Property,"The status of the use of the scientificName as a label for a taxon. Requires taxonomic opinion to define the scope of a taxon. Rules of priority then are used to define the taxonomic status of the nomenclature contained in that scope, combined with the experts opinion. It must be linked to a specific taxonomic reference that defines the concept. Recommended best practice is to use a controlled vocabulary."
Taxon Rank,2009-04-24,superseded,http://rs.tdwg.org/dwc/terms/taxonRank,http://rs.tdwg.org/dwc/terms/version/taxonRank-2009-04-24,http://rs.tdwg.org/dwc/dwcore/version/InfraspecificRank-2007-04-17,http://www.w3.org/1999/02/22-rdf-syntax-ns#Property,The taxonomic rank of the most specific name in the scientificName. Recommended best practice is to use a controlled vocabulary.
Taxon Rank,2009-09-21,recommended,http://rs.tdwg.org/dwc/terms/taxonRank,http://rs.tdwg.org/dwc/terms/version/taxonRank-2009-09-21,http://rs.tdwg.org/dwc/terms/version/scientificNameRank-2009-07-06,http://www.w3.org/1999/02/22-rdf-syntax-ns#Property,The taxonomic rank of the most specific name in the scientificName. Recommended best practice is to use a controlled vocabulary.
Taxon Remarks,2009-04-24,superseded,http://rs.tdwg.org/dwc/terms/taxonRemarks,http://rs.tdwg.org/dwc/terms/version/taxonRemarks-2009-04-24,,http://www.w3.org/1999/02/22-rdf-syntax-ns#Property,Comments or notes about the taxon.
Taxon Remarks,2009-08-24,recommended,http://rs.tdwg.org/dwc/terms/taxonRemarks,http://rs.tdwg.org/dwc/terms/version/taxonRemarks-2009-08-24,http://rs.tdwg.org/dwc/terms/version/taxonRemarks-2009-04-24,http://www.w3.org/1999/02/22-rdf-syntax-ns#Property,Comments or notes about the taxon or name.
Type Status,2009-04-24,superseded,http://rs.tdwg.org/dwc/terms/typeStatus,http://rs.tdwg.org/dwc/terms/version/typeStatus-2009-04-24,http://rs.tdwg.org/dwc/curatorial/version/TypeStatus-2007-04-17,http://www.w3.org/1999/02/22-rdf-syntax-ns#Property,"A list (concatenated and separated) of nomenclatural types (type status, typified scientific name, publication) applied to the subject."
Type Status,2014-10-23,recommended,http://rs.tdwg.org/dwc/terms/typeStatus,http://rs.tdwg.org/dwc/terms/version/typeStatus-2014-10-23,http://rs.tdwg.org/dwc/terms/version/typeStatus-2009-04-24,http://www.w3.org/1999/02/22-rdf-syntax-ns#Property,"A list (concatenated and separated) of nomenclatural types (type status, typified scientific name, publication) applied to the subject."
Verbatim Coordinates,2009-04-24,recommended,http://rs.tdwg.org/dwc/terms/verbatimCoordinates,http://rs.tdwg.org/dwc/terms/version/verbatimCoordinates-2009-04-24,http://rs.tdwg.org/dwc/geospatial/version/VerbatimCoordinates-2007-04-17,http://www.w3.org/1999/02/22-rdf-syntax-ns#Property,"The verbatim original spatial coordinates of the Location. The coordinate ellipsoid, geodeticDatum, or full Spatial Reference System (SRS) for these coordinates should be stored in verbatimSRS and the coordinate system should be stored in verbatimCoordinateSystem."
Verbatim Coordinate System,2009-04-24,recommended,http://rs.tdwg.org/dwc/terms/verbatimCoordinateSystem,http://rs.tdwg.org/dwc/terms/version/verbatimCoordinateSystem-2009-04-24,http://rs.tdwg.org/dwc/geospatial/version/VerbatimCoordinateSystem-2007-04-17,http://www.w3.org/1999/02/22-rdf-syntax-ns#Property,The spatial coordinate system for the verbatimLatitude and verbatimLongitude or the verbatimCoordinates of the Location. Recommended best practice is to use a controlled vocabulary.
Verbatim Depth,2009-04-24,recommended,http://rs.tdwg.org/dwc/terms/verbatimDepth,http://rs.tdwg.org/dwc/terms/version/verbatimDepth-2009-04-24,http://rs.tdwg.org/dwc/curatorial/version/VerbatimDepth-2007-04-17,http://www.w3.org/1999/02/22-rdf-syntax-ns#Property,The original description of the depth below the local surface.
Verbatim Elevation,2009-04-24,recommended,http://rs.tdwg.org/dwc/terms/verbatimElevation,http://rs.tdwg.org/dwc/terms/version/verbatimElevation-2009-04-24,http://rs.tdwg.org/dwc/curatorial/version/VerbatimElevation-2007-04-17,http://www.w3.org/1999/02/22-rdf-syntax-ns#Property,"The original description of the elevation (altitude, usually above sea level) of the Location."
Verbatim EventDate,2009-04-24,recommended,http://rs.tdwg.org/dwc/terms/verbatimEventDate,http://rs.tdwg.org/dwc/terms/version/verbatimEventDate-2009-04-24,http://rs.tdwg.org/dwc/curatorial/version/VerbatimCollectingDate-2007-04-17,http://www.w3.org/1999/02/22-rdf-syntax-ns#Property,The verbatim original representation of the date and time information for an Event.
Verbatim Latitude,2009-04-24,recommended,http://rs.tdwg.org/dwc/terms/verbatimLatitude,http://rs.tdwg.org/dwc/terms/version/verbatimLatitude-2009-04-24,http://rs.tdwg.org/dwc/geospatial/version/VerbatimLatitude-2007-04-17,http://www.w3.org/1999/02/22-rdf-syntax-ns#Property,"The verbatim original latitude of the Location. The coordinate ellipsoid, geodeticDatum, or full Spatial Reference System (SRS) for these coordinates should be stored in verbatimSRS and the coordinate system should be stored in verbatimCoordinateSystem."
Verbatim Locality,2009-04-24,recommended,http://rs.tdwg.org/dwc/terms/verbatimLocality,http://rs.tdwg.org/dwc/terms/version/verbatimLocality-2009-04-24,,http://www.w3.org/1999/02/22-rdf-syntax-ns#Property,The original textual description of the place.
Verbatim Longitude,2009-04-24,recommended,http://rs.tdwg.org/dwc/terms/verbatimLongitude,http://rs.tdwg.org/dwc/terms/version/verbatimLongitude-2009-04-24,http://rs.tdwg.org/dwc/geospatial/version/VerbatimLongitude-2007-04-17,http://www.w3.org/1999/02/22-rdf-syntax-ns#Property,"The verbatim original longitude of the Location. The coordinate ellipsoid, geodeticDatum, or full Spatial Reference System (SRS) for these coordinates should be stored in verbatimSRS and the coordinate system should be stored in verbatimCoordinateSystem."
Verbatim Scientific Name Rank,2009-07-06,deprecated,http://rs.tdwg.org/dwc/terms/verbatimScientificNameRank,http://rs.tdwg.org/dwc/terms/version/verbatimScientificNameRank-2009-07-06,,http://www.w3.org/1999/02/22-rdf-syntax-ns#Property,The taxonomic rank of the most specific name in the scientificName as it appears in the original record.
Verbatim SRS,2009-07-06,recommended,http://rs.tdwg.org/dwc/terms/verbatimSRS,http://rs.tdwg.org/dwc/terms/version/verbatimSRS-2009-07-06,,http://www.w3.org/1999/02/22-rdf-syntax-ns#Property,"The ellipsoid, geodetic datum, or spatial reference system (SRS) upon which coordinates given in verbatimLatitude and verbatimLongitude, or verbatimCoordinates are based. Recommended best practice is use the EPSG code as a controlled vocabulary to provide an SRS, if known. Otherwise use a controlled vocabulary for the name or code of the geodetic datum, if known. Otherwise use a controlled vocabulary for the name or code of the ellipsoid, if known. If none of these is known, use the value ""unknown""."
Verbatim Taxon Rank,2009-09-21,recommended,http://rs.tdwg.org/dwc/terms/verbatimTaxonRank,http://rs.tdwg.org/dwc/terms/version/verbatimTaxonRank-2009-09-21,http://rs.tdwg.org/dwc/terms/version/verbatimScientificNameRank-2009-07-06,http://www.w3.org/1999/02/22-rdf-syntax-ns#Property,The taxonomic rank of the most specific name in the scientificName as it appears in the original record.
Vernacular Name,2009-07-06,recommended,http://rs.tdwg.org/dwc/terms/vernacularName,http://rs.tdwg.org/dwc/terms/version/vernacularName-2009-07-06,,http://www.w3.org/1999/02/22-rdf-syntax-ns#Property,A common or vernacular name.
Water Body,2009-04-24,recommended,http://rs.tdwg.org/dwc/terms/waterBody,http://rs.tdwg.org/dwc/terms/version/waterBody-2009-04-24,http://rs.tdwg.org/dwc/dwcore/version/WaterBody-2007-04-17,http://www.w3.org/1999/02/22-rdf-syntax-ns#Property,The name of the water body in which the Location occurs. Recommended best practice is to use a controlled vocabulary such as the Getty Thesaurus of Geographic Names.
Year,2009-04-24,recommended,http://rs.tdwg.org/dwc/terms/year,http://rs.tdwg.org/dwc/terms/version/year-2009-04-24,http://digir.net/schema/conceptual/darwin/2003/1.0/version/YearCollected-2003-06-17,http://www.w3.org/1999/02/22-rdf-syntax-ns#Property,"The four-digit year in which the Event occurred, according to the Common Era Calendar."
type,2008-01-14,recommended,http://purl.org/dc/terms/type,http://dublincore.org/usage/terms/history/#typeT-001,,http://www.w3.org/1999/02/22-rdf-syntax-ns#Property,"The nature or genre of the resource. For Darwin Core, recommended best practice is to use the name of the class that defines the root of the record."
