iri,label,definition,comments,examples,organized_in,issued,status,replaces,rdf_type,term_iri,abcd_equivalence,flags
http://rs.tdwg.org/dwc/dwcore/version/BasisOfRecord-2007-04-17,BasisOfRecord,"A descriptive term indicating whether the record represents an object or observation. Examples: PreservedSpecimen- A physical object representing one or more organisms, part of organism, or artifact of an organism. synonyms: voucher, collection, lot. FossilSpecimen- A physical object representing one or more fossil organisms, part of fossil organism, or artifact of a fossil organism. LivingSpecimen- An organism removed from its natural occurrence and now living in captivity or cultivation. HumanObservation- A report by a known observer that an organism was present at the place and time. MachineObservation- A report by a monitoring device that an organism was present at the place and time. StillImage- An photograph, drawing, painting. MovingImage- A sequence of still images taken at regular intervals and intended to be played back as a moving image; may include sound. SoundRecording- An audio recording. OtherSpecimen- Any type of specimen not covered by any of the categories above.",,,,2007-04-17,deprecated,http://digir.net/schema/conceptual/darwin/2003/1.0/version/BasisOfRecord-2003-06-17,http://www.w3.org/1999/02/22-rdf-syntax-ns#Property,http://rs.tdwg.org/dwc/dwcore/BasisOfRecord,,
http://rs.tdwg.org/dwc/dwcore/version/CatalogNumber-2007-04-17,CatalogNumber,"The alphanumeric value identifying a record within the collection. It is highly recommended that each record be uniquely identified within a collection by this value. It is also recommended that each record be uniquely identified in a global context by the combination of InstitutionCode, CollectionCode and CatalogNumber.",,,,2007-04-17,deprecated,http://digir.net/schema/conceptual/darwin/2003/1.0/version/CatalogNumberText-2003-06-17,http://www.w3.org/1999/02/22-rdf-syntax-ns#Property,http://rs.tdwg.org/dwc/dwcore/CatalogNumber,,
http://rs.tdwg.org/dwc/dwcore/version/Class-2007-04-17,Class,The name of the class in which the organism is classified.,,,,2007-04-17,deprecated,http://digir.net/schema/conceptual/darwin/2003/1.0/version/Class-2003-06-17,http://www.w3.org/1999/02/22-rdf-syntax-ns#Property,http://rs.tdwg.org/dwc/dwcore/Class,,
http://rs.tdwg.org/dwc/dwcore/version/CollectingMethod-2007-04-17,CollectingMethod,"The name of, reference to, or brief description of the method or protocol under which the collecting event occurred. Examples: ""UV light trap"", ""mist net"", ""bottom trawl"".",,,,2007-04-17,deprecated,,http://www.w3.org/1999/02/22-rdf-syntax-ns#Property,http://rs.tdwg.org/dwc/dwcore/CollectingMethod,,
http://rs.tdwg.org/dwc/dwcore/version/CollectionCode-2007-04-17,CollectionCode,The code (or acronym) identifying the collection within the institution in which the organism record is cataloged.,,,,2007-04-17,deprecated,http://digir.net/schema/conceptual/darwin/2003/1.0/version/CollectionCode-2003-06-17,http://www.w3.org/1999/02/22-rdf-syntax-ns#Property,http://rs.tdwg.org/dwc/dwcore/CollectionCode,,
http://rs.tdwg.org/dwc/dwcore/version/Collector-2007-04-17,Collector,"The name(s) (concatenated and separated) of collectors or observers. ""LIKE"" or ""contains"" substring query operations are meant to be used with this element to find matching collector names. The primary collector or observer, especially one whose CollectorNumber is also provided, should be listed first. Example: ""Oliver P. Pearson, Anita K. Pearson"" where the value in CollectorNumber ""OPP 7101"" corresponds to the number for the specimen in the field catalog (collector number) of Oliver P. Pearson.",,,,2007-04-17,deprecated,http://digir.net/schema/conceptual/darwin/2003/1.0/version/Collector-2003-06-17,http://www.w3.org/1999/02/22-rdf-syntax-ns#Property,http://rs.tdwg.org/dwc/dwcore/Collector,,
http://rs.tdwg.org/dwc/dwcore/version/Continent-2007-04-17,Continent,"The full, unabbreviated name of the continent on which the organism was collected or observed.",,,,2007-04-17,deprecated,http://digir.net/schema/conceptual/darwin/2003/1.0/version/ContinentOcean-2003-06-17,http://www.w3.org/1999/02/22-rdf-syntax-ns#Property,http://rs.tdwg.org/dwc/dwcore/Continent,,
http://rs.tdwg.org/dwc/dwcore/version/Country-2007-04-17,Country,"The full, unabbreviated name of the country or major political unit in which the organism was collected or observed.",,,,2007-04-17,deprecated,http://digir.net/schema/conceptual/darwin/2003/1.0/version/Country-2003-06-17,http://www.w3.org/1999/02/22-rdf-syntax-ns#Property,http://rs.tdwg.org/dwc/dwcore/Country,,
http://rs.tdwg.org/dwc/dwcore/version/County-2007-04-17,County,"The full, unabbreviated name of the county, shire, or municipality (i.e., the next smaller political region than StateProvince) in which the organism was collected or observed.",,,,2007-04-17,deprecated,http://digir.net/schema/conceptual/darwin/2003/1.0/version/County-2003-06-17,http://www.w3.org/1999/02/22-rdf-syntax-ns#Property,http://rs.tdwg.org/dwc/dwcore/County,,
http://rs.tdwg.org/dwc/dwcore/version/DateLastModified-2007-04-17,DateLastModified,"The last date-time of publication when any of the data for the record were modified from the previous publication of that record. When publishing a record for the first time, use the publication date-time. Returns values as ISO 8601 date and time. (cf. http://www.w3.org/TR/xmlschema-2/#isoformats and http://www.iso.org/iso/en/prods-services/popstds/dateandtime.html Example: November 5, 1994, 8:15:30 am, US Eastern Standard Time"" would be ""1994-11-05T13:15:30Z""",,,,2007-04-17,deprecated,http://digir.net/schema/conceptual/darwin/2003/1.0/version/DateLastModified-2003-06-17,http://www.w3.org/1999/02/22-rdf-syntax-ns#Property,http://rs.tdwg.org/dwc/dwcore/DateLastModified,,
http://rs.tdwg.org/dwc/dwcore/version/DayOfYear-2007-04-17,DayOfYear,"The ordinal day of the year on which the object or observation was collected (1 for January 1, 365 for December 31, except in a leap year, in which case it is 366). If the EarliestDateCollected and LatestDateCollected do not occur on the same day, do not populate DayOfYear.",,,,2007-04-17,deprecated,http://digir.net/schema/conceptual/darwin/2003/1.0/version/JulianDay-2003-06-17,http://www.w3.org/1999/02/22-rdf-syntax-ns#Property,http://rs.tdwg.org/dwc/dwcore/DayOfYear,,
http://rs.tdwg.org/dwc/dwcore/version/EarliestDateCollected-2007-04-17,EarliestDateCollected,"The earliest date-time (Common Era calendar) in a date-time period during which an organism or group of organisms was collected or observed. If the event is recorded as occurring at a single date-time, populate both EarliestDateCollected and LatestDateCollected with the same value.",,,,2007-04-17,deprecated,http://digir.net/schema/conceptual/darwin/2003/1.0/version/DayCollected-2003-06-17|http://digir.net/schema/conceptual/darwin/2003/1.0/version/MonthCollected-2003-06-17|http://digir.net/schema/conceptual/darwin/2003/1.0/version/YearCollected-2003-06-17,http://www.w3.org/1999/02/22-rdf-syntax-ns#Property,http://rs.tdwg.org/dwc/dwcore/EarliestDateCollected,,
http://rs.tdwg.org/dwc/dwcore/version/Family-2007-04-17,Family,The name of the family in which the organism is classified.,,,,2007-04-17,deprecated,http://digir.net/schema/conceptual/darwin/2003/1.0/version/Family-2003-06-17,http://www.w3.org/1999/02/22-rdf-syntax-ns#Property,http://rs.tdwg.org/dwc/dwcore/Family,,
http://rs.tdwg.org/dwc/dwcore/version/Genus-2007-04-17,Genus,The name of the genus in which the organism is classified.,,,,2007-04-17,deprecated,http://digir.net/schema/conceptual/darwin/2003/1.0/version/Genus-2003-06-17,http://www.w3.org/1999/02/22-rdf-syntax-ns#Property,http://rs.tdwg.org/dwc/dwcore/Genus,,
http://rs.tdwg.org/dwc/dwcore/version/GlobalUniqueIdentifier-2007-04-17,GlobalUniqueIdentifier,"A Uniform Resource Name (URN) as a unique identifier for the specimen or observation record. In the absence of a persistent global unique identifier, construct one in the form: ""[InstitutionCode]:[CollectionCode]: [CatalogNumber]"" Examples: 1) urn:lsid:nhm.ku.edu:Herps:32 2) ""FMNH:Mammal:145732""",,,,2007-04-17,deprecated,,http://www.w3.org/1999/02/22-rdf-syntax-ns#Property,http://rs.tdwg.org/dwc/dwcore/GlobalUniqueIdentifier,,
http://rs.tdwg.org/dwc/dwcore/version/HigherGeography-2007-04-17,HigherGeography,"The names (concatenated and separated) of geographic elements less specific than the information in the Locality element. ""LIKE"" or ""contains"" substring query operations are meant to be used with this element to find matching geographic names. This can be useful if it is unclear in which element a name might be found, and in cases where there is no other appropriate geographic element. Example: ""South America, Argentina, Patagonia, Parque Nacional Nahuel Huapi, Neuquén, Los Lagos"" with accompanying values ""South America"" in Continent, ""Argentina"" in Country, ""Neuquén"" in StateProvince, and Los Lagos in County.",,,,2007-04-17,deprecated,http://digir.net/schema/conceptual/darwin/2003/1.0/version/HigherGeography-2003-06-17,http://www.w3.org/1999/02/22-rdf-syntax-ns#Property,http://rs.tdwg.org/dwc/dwcore/HigherGeography,,
http://rs.tdwg.org/dwc/dwcore/version/HigherTaxon-2007-04-17,HigherTaxon,"The names of taxonomic ranks less specific than SpecificEpithet concatenated and separated. ""LIKE"" or ""contains"" substring query operations are meant to be used with this element to find matching higher taxon names. This element may contain the list of scientific names of all of the supra-specific taxa in the classification used to identify (determine) the specimen or observation. Example: ""Animalia, Chordata, Vertebrata, Mammalia, Theria, Eutheria, Rodentia, Hystricognatha, Hystricognathi, Ctenomyidae, Ctenomyini, Ctenomys"".",,,,2007-04-17,deprecated,http://digir.net/schema/conceptual/darwin/2003/1.0/version/HigherTaxon-2003-06-17,http://www.w3.org/1999/02/22-rdf-syntax-ns#Property,http://rs.tdwg.org/dwc/dwcore/HigherTaxon,,
http://rs.tdwg.org/dwc/dwcore/version/IdentificationQualifier-2007-04-17,IdentificationQualifier,"A brief phrase or a standard term (""cf."", ""aff."") to qualify the identification of the organism when doubts have arisen as to its taxonomic identity (determination). Examples: 1) For the determination ""Quercus aff. agrifolia var. oxyadenia"", IdentificationQualifier would be ""aff. agrifolia var. oxyadenia"" with accompanying values ""Quercus"" in Genus, ""agrifolia"" in SpecificEpithet, ""oxyadenia"" in InfraspecificEpithet, and ""var."" in InfraspecificRank. 2) For the determination ""Quercus agrifolia cf. var. oxyadenia"", IdentificationQualifier would be ""cf. var. oxyadenia "" with accompanying values ""Quercus"" in Genus, ""agrifolia"" in SpecificEpithet, ""oxyadenia"" in InfraspecificEpithet, and ""var."" in InfraspecificRank.",,,,2007-04-17,deprecated,http://digir.net/schema/conceptual/darwin/2003/1.0/version/IdentificationModifier-2003-06-17,http://www.w3.org/1999/02/22-rdf-syntax-ns#Property,http://rs.tdwg.org/dwc/dwcore/IdentificationQualifier,,
http://rs.tdwg.org/dwc/dwcore/version/ImageURL-2007-04-17,ImageURL,A Universal Resource Locator reference to digital images associated with the specimen or observation.,,,,2007-04-17,deprecated,,http://www.w3.org/1999/02/22-rdf-syntax-ns#Property,http://rs.tdwg.org/dwc/dwcore/ImageURL,,
http://rs.tdwg.org/dwc/dwcore/version/InformationWithheld-2007-04-17,InformationWithheld,"Brief descriptions of additional information that may exist, but that has not been made public. Information about obtaining the withheld information should be sought from the administrative contact identified in the provider resource metadata (curator, collection manager). Examples: ""specific locality information given only to nearest county"", ""ask about tissue samples"", ""georeferences given only to nearest degree"".",,,,2007-04-17,deprecated,,http://www.w3.org/1999/02/22-rdf-syntax-ns#Property,http://rs.tdwg.org/dwc/dwcore/InformationWithheld,,
http://rs.tdwg.org/dwc/dwcore/version/InfraspecificEpithet-2007-04-17,InfraspecificEpithet,The infraspecific epithet of the scientific name applied to the organism.,,,,2007-04-17,deprecated,http://digir.net/schema/conceptual/darwin/2003/1.0/version/Subspecies-2003-06-17,http://www.w3.org/1999/02/22-rdf-syntax-ns#Property,http://rs.tdwg.org/dwc/dwcore/InfraspecificEpithet,,
http://rs.tdwg.org/dwc/dwcore/version/InfraspecificRank-2007-04-17,InfraspecificRank,"The infraspecific rank (subspecies, variety, forma) of the InfraspecificEpithet. Examples: ""subsp."", ""var."", ""forma"".",,,,2007-04-17,deprecated,,http://www.w3.org/1999/02/22-rdf-syntax-ns#Property,http://rs.tdwg.org/dwc/dwcore/InfraspecificRank,,
http://rs.tdwg.org/dwc/dwcore/version/InstitutionCode-2007-04-17,InstitutionCode,"The code (or acronym) identifying the institution administering the collection in which the organism record is cataloged. No global registry exists for institutional codes; use the code that is ""standard"" at your institution or in your discipline.",,,,2007-04-17,deprecated,http://digir.net/schema/conceptual/darwin/2003/1.0/version/InstitutionCode-2003-06-17,http://www.w3.org/1999/02/22-rdf-syntax-ns#Property,http://rs.tdwg.org/dwc/dwcore/InstitutionCode,,
http://rs.tdwg.org/dwc/dwcore/version/Island-2007-04-17,Island,"The full, unabbreviated name of the island on which the organism was collected or observed.",,,,2007-04-17,deprecated,http://digir.net/schema/conceptual/darwin/2003/1.0/version/Island-2003-06-17,http://www.w3.org/1999/02/22-rdf-syntax-ns#Property,http://rs.tdwg.org/dwc/dwcore/Island,,
http://rs.tdwg.org/dwc/dwcore/version/IslandGroup-2007-04-17,IslandGroup,"The full, unabbreviated name of the island group in which the organism was collected or observed.",,,,2007-04-17,deprecated,http://digir.net/schema/conceptual/darwin/2003/1.0/version/IslandGroup-2003-06-17,http://www.w3.org/1999/02/22-rdf-syntax-ns#Property,http://rs.tdwg.org/dwc/dwcore/IslandGroup,,
http://rs.tdwg.org/dwc/dwcore/version/Kingdom-2007-04-17,Kingdom,The name of the kingdom in which the organism is classified.,,,,2007-04-17,deprecated,http://digir.net/schema/conceptual/darwin/2003/1.0/version/Kingdom-2003-06-17,http://www.w3.org/1999/02/22-rdf-syntax-ns#Property,http://rs.tdwg.org/dwc/dwcore/Kingdom,,
http://rs.tdwg.org/dwc/dwcore/version/LatestDateCollected-2007-04-17,LatestDateCollected,"The latest date-time (Common Era calendar) in a date-time period during which an organism or group of organisms was collected or observed. If the event is recorded as occurring at a single date-time, populate both EarliestDateCollected and LatestDateCollected with the same value.",,,,2007-04-17,deprecated,http://digir.net/schema/conceptual/darwin/2003/1.0/version/DayCollected-2003-06-17|http://digir.net/schema/conceptual/darwin/2003/1.0/version/MonthCollected-2003-06-17|http://digir.net/schema/conceptual/darwin/2003/1.0/version/YearCollected-2003-06-17,http://www.w3.org/1999/02/22-rdf-syntax-ns#Property,http://rs.tdwg.org/dwc/dwcore/LatestDateCollected,,
http://rs.tdwg.org/dwc/dwcore/version/LifeStage-2007-04-17,LifeStage,"The age class or life stage of the biological individual represented by the catalogued object or observation. Examples: ""adult"", ""mature"", ""juvenile"", ""eft"", ""nymph"", ""seedling"", ""seed"", ""egg""",,,,2007-04-17,deprecated,http://digir.net/schema/conceptual/darwin/2003/1.0/version/AgeClass-2003-06-17,http://www.w3.org/1999/02/22-rdf-syntax-ns#Property,http://rs.tdwg.org/dwc/dwcore/LifeStage,,
http://rs.tdwg.org/dwc/dwcore/version/Locality-2007-04-17,Locality,"The specific natural language description of the place where the organism was collected or observed. This element need not contain less specific geographic information provided in other geographic elements (HigherGeography, Continent, Country, StateProvince, County, WaterBody, Island, IslandGroup). Though coordinate information can be contained in this concept, these data will be usable analytically only when shared through the concepts of the Geospatial Extension.",,,,2007-04-17,deprecated,http://digir.net/schema/conceptual/darwin/2003/1.0/version/Locality-2003-06-17,http://www.w3.org/1999/02/22-rdf-syntax-ns#Property,http://rs.tdwg.org/dwc/dwcore/Locality,,
http://rs.tdwg.org/dwc/dwcore/version/MaximumDepthInMeters-2007-04-17,MaximumDepthInMeters,The maximum or actual depth at which the collection or observation was made. Use positive values for locations below the surface. Examples: 10 (for a depth of up to 10m). 100 (for a depth between 50m and 100m).,,,,2007-04-17,deprecated,http://digir.net/schema/conceptual/darwin/2003/1.0/version/MaximumDepthInMeters-2003-06-17,http://www.w3.org/1999/02/22-rdf-syntax-ns#Property,http://rs.tdwg.org/dwc/dwcore/MaximumDepthInMeters,,
http://rs.tdwg.org/dwc/dwcore/version/MaximumElevationInMeters-2007-04-17,MaximumElevationInMeters,The maximum or actual elevation at which the collection or observation was made. Use negative values for locations below sea level. Examples: Examples: 125 (for an elevation of 100 +- 25 meters). 200 (for an elevation between 100m and 200m).,,,,2007-04-17,deprecated,http://digir.net/schema/conceptual/darwin/2003/1.0/version/MaximumElevationInMeters-2003-06-17,http://www.w3.org/1999/02/22-rdf-syntax-ns#Property,http://rs.tdwg.org/dwc/dwcore/MaximumElevationInMeters,,
http://rs.tdwg.org/dwc/dwcore/version/MinimumDepthInMeters-2007-04-17,MinimumDepthInMeters,The minimum or actual depth at which the collection or observation was made. Use positive values for locations below the surface. Examples: 0 (for a depth of up to 10m). 50 (for a depth between 50m and 100m).,,,,2007-04-17,deprecated,http://digir.net/schema/conceptual/darwin/2003/1.0/version/MinimumDepthInMeters-2003-06-17,http://www.w3.org/1999/02/22-rdf-syntax-ns#Property,http://rs.tdwg.org/dwc/dwcore/MinimumDepthInMeters,,
http://rs.tdwg.org/dwc/dwcore/version/MinimumElevationInMeters-2007-04-17,MinimumElevationInMeters,The minimum or actual elevation at which the collection or observation was made. Use negative values for locations below sea level. Examples: 75 (for an elevation of 100 +- 25 meters). 100 (for an elevation between 100m and 200m).,,,,2007-04-17,deprecated,http://digir.net/schema/conceptual/darwin/2003/1.0/version/MinimumElevationInMeters-2003-06-17,http://www.w3.org/1999/02/22-rdf-syntax-ns#Property,http://rs.tdwg.org/dwc/dwcore/MinimumElevationInMeters,,
http://rs.tdwg.org/dwc/dwcore/version/NomenclaturalCode-2007-04-17,NomenclaturalCode,"The nomenclatural code under which the ScientificName is constructed. Examples: ""ICBN"", ""ICZN"", ""BC"", ""ICNCP"", ""BioCode""",,,,2007-04-17,deprecated,,http://www.w3.org/1999/02/22-rdf-syntax-ns#Property,http://rs.tdwg.org/dwc/dwcore/NomenclaturalCode,,
http://rs.tdwg.org/dwc/dwcore/version/Order-2007-04-17,Order,The name of the order in which the organism is classified.,,,,2007-04-17,deprecated,http://digir.net/schema/conceptual/darwin/2003/1.0/version/Order-2003-06-17,http://www.w3.org/1999/02/22-rdf-syntax-ns#Property,http://rs.tdwg.org/dwc/dwcore/Order,,
http://rs.tdwg.org/dwc/dwcore/version/Phylum-2007-04-17,Phylum,The name of the phylum (or division) in which the organism is classified.,,,,2007-04-17,deprecated,http://digir.net/schema/conceptual/darwin/2003/1.0/version/Phylum-2003-06-17,http://www.w3.org/1999/02/22-rdf-syntax-ns#Property,http://rs.tdwg.org/dwc/dwcore/Phylum,,
http://rs.tdwg.org/dwc/dwcore/version/RelatedInformation-2007-04-17,RelatedInformation,"Free text references to information not delivered via the conceptual schema, including URLs to specimen details, publications, bibliographic references, etc.",,,,2007-04-17,deprecated,http://www.iobis.org/obis/version/RecordURL-2005-07-10,http://www.w3.org/1999/02/22-rdf-syntax-ns#Property,http://rs.tdwg.org/dwc/dwcore/RelatedInformation,,
http://rs.tdwg.org/dwc/dwcore/version/Remarks-2007-04-17,Remarks,Free text comments accompanying the object or observation record.,,,,2007-04-17,deprecated,http://digir.net/schema/conceptual/darwin/2003/1.0/version/Remarks-2003-06-17,http://www.w3.org/1999/02/22-rdf-syntax-ns#Property,http://rs.tdwg.org/dwc/dwcore/Remarks,,
http://rs.tdwg.org/dwc/dwcore/version/ScientificName-2007-04-17,ScientificName,"The full name of the lowest level taxon to which the organism has been identified in the most recent accepted determination, specified as precisely as possible, including name-author, year or authorship, sensu or sec. (according to or following) author, and indication of uncertainty. Conceptually equivalent to a full taxonomic identification as given by the identifier (verbatim). Does not include the identifier name or date of identification. Examples: ""Coleoptera"" (an Order), ""Vespertilionidae"" (a Family), ""Manis"" (a Genus), ""Ctenomys sociabilis"" (Genus + SpecificEpithet), ""Ambystoma tigrinum diaboli"" (Genus + SpecificEpithet + SubspecificEpithet), ""Quercus agrifolia var. oxyadenia (Torr.) J.T. Howell"" (Genus + SpecificEpithet + InfraspecificRank + InfraspecificEpithet + AuthorYearOfScientificName).",,,,2007-04-17,deprecated,http://digir.net/schema/conceptual/darwin/2003/1.0/version/ScientificName-2003-06-17,http://www.w3.org/1999/02/22-rdf-syntax-ns#Property,http://rs.tdwg.org/dwc/dwcore/ScientificName,,
http://rs.tdwg.org/dwc/dwcore/version/Sex-2007-04-17,Sex,"The sex of the biological individual represented by the cataloged object or observation. Examples: ""male"", ""female"", ""hermaphrodite"", ""gynandromorph"", ""monoecious"", ""dioecious"", ""not recorded"", ""indeterminate"", ""transitional"".",,,,2007-04-17,deprecated,http://digir.net/schema/conceptual/darwin/2003/1.0/version/Sex-2003-06-17,http://www.w3.org/1999/02/22-rdf-syntax-ns#Property,http://rs.tdwg.org/dwc/dwcore/Sex,,
http://rs.tdwg.org/dwc/dwcore/version/SpecificEpithet-2007-04-17,SpecificEpithet,The specific epithet of the scientific name applied to the organism.,,,,2007-04-17,deprecated,http://digir.net/schema/conceptual/darwin/2003/1.0/version/Species-2003-06-17,http://www.w3.org/1999/02/22-rdf-syntax-ns#Property,http://rs.tdwg.org/dwc/dwcore/SpecificEpithet,,
http://rs.tdwg.org/dwc/dwcore/version/StateProvince-2007-04-17,StateProvince,"The full, unabbreviated name of the state, province, or region (i.e., the next smaller political region than Country) in which the organism was collected or observed.",,,,2007-04-17,deprecated,http://digir.net/schema/conceptual/darwin/2003/1.0/version/StateProvince-2003-06-17,http://www.w3.org/1999/02/22-rdf-syntax-ns#Property,http://rs.tdwg.org/dwc/dwcore/StateProvince,,
http://rs.tdwg.org/dwc/dwcore/version/ValidDistributionFlag-2007-04-17,ValidDistributionFlag,"A flag (""true"" or ""false"") that indicates whether the locality information represents a valid distribution occurrence for a specimen. Specimens taken from captivity and showing the captive location should use the value ""false"".",,,,2007-04-17,deprecated,,http://www.w3.org/1999/02/22-rdf-syntax-ns#Property,http://rs.tdwg.org/dwc/dwcore/ValidDistributionFlag,,
http://rs.tdwg.org/dwc/dwcore/version/WaterBody-2007-04-17,WaterBody,"The full, unabbreviated name of the body of water in or over which the organism was collected or observed.",,,,2007-04-17,deprecated,http://digir.net/schema/conceptual/darwin/2003/1.0/version/ContinentOcean-2003-06-17,http://www.w3.org/1999/02/22-rdf-syntax-ns#Property,http://rs.tdwg.org/dwc/dwcore/WaterBody,,
http://rs.tdwg.org/dwc/dwctype/version/FossilSpecimen-2008-11-19,FossilSpecimen,A resource describing a fossilized specimen.,,,,2008-11-19,superseded,,http://www.w3.org/2000/01/rdf-schema#Class,http://rs.tdwg.org/dwc/dwctype/FossilSpecimen,,
http://rs.tdwg.org/dwc/dwctype/version/FossilSpecimen-2011-10-16,FossilSpecimen,A resource describing a fossilized specimen.,,,,2011-10-16,deprecated,http://rs.tdwg.org/dwc/dwctype/version/FossilSpecimen-2008-11-19,http://www.w3.org/2000/01/rdf-schema#Class,http://rs.tdwg.org/dwc/dwctype/FossilSpecimen,,
http://rs.tdwg.org/dwc/dwctype/version/HumanObservation-2008-11-19,HumanObservation,A resource describing an observation made by one or more people.,,,,2008-11-19,superseded,,http://www.w3.org/2000/01/rdf-schema#Class,http://rs.tdwg.org/dwc/dwctype/HumanObservation,,
http://rs.tdwg.org/dwc/dwctype/version/HumanObservation-2011-10-16,HumanObservation,A resource describing an observation made by one or more people.,,,,2011-10-16,deprecated,http://rs.tdwg.org/dwc/dwctype/version/HumanObservation-2008-11-19,http://www.w3.org/2000/01/rdf-schema#Class,http://rs.tdwg.org/dwc/dwctype/HumanObservation,,
http://rs.tdwg.org/dwc/dwctype/version/LivingSpecimen-2008-11-19,LivingSpecimen,A resource describing a living specimen.,,,,2008-11-19,superseded,,http://www.w3.org/2000/01/rdf-schema#Class,http://rs.tdwg.org/dwc/dwctype/LivingSpecimen,,
http://rs.tdwg.org/dwc/dwctype/version/LivingSpecimen-2011-10-16,LivingSpecimen,A resource describing a living specimen.,,,,2011-10-16,deprecated,http://rs.tdwg.org/dwc/dwctype/version/LivingSpecimen-2008-11-19,http://www.w3.org/2000/01/rdf-schema#Class,http://rs.tdwg.org/dwc/dwctype/LivingSpecimen,,
http://rs.tdwg.org/dwc/dwctype/version/Location-2009-04-24,Location,A resource describing an instance of the Location class.,,,,2009-04-24,deprecated,,http://www.w3.org/2000/01/rdf-schema#Class,http://rs.tdwg.org/dwc/dwctype/Location,,
http://rs.tdwg.org/dwc/dwctype/version/MachineObservation-2008-11-19,MachineObservation,A resource describing an observation made by a machine.,,,,2008-11-19,superseded,,http://www.w3.org/2000/01/rdf-schema#Class,http://rs.tdwg.org/dwc/dwctype/MachineObservation,,
